No.,Title,Release Year,Movie Info,Distributor,Domestic Sales (in $),International Sales (in $),World Sales (in $),License
177,Aladdin (1992),1992,A kindhearted street urchin and a power-hungry Grand Vizier vie for a magic lamp that has the power to make their deepest wishes come true.,Walt Disney Studios Motion Pictures,"$217,350,219.00","$286,700,000.00","$504,050,219.00",PG
178,Alvin and the Chipmunks (2007),2007,Three musical chipmunks are discovered by an aspiring songwriter who wants to use their amazing singing abilities to become famous.,Twentieth Century Fox,"$217,326,974.00","$148,025,572.00","$365,352,546.00",PG
179,Saving Private Ryan (1998),1998,"Following the Normandy Landings, a group of U.S. soldiers go behind enemy lines to retrieve a paratrooper whose brothers have been killed in action.",DreamWorks Distribution,"$217,049,603.00","$265,300,000.00","$482,349,603.00",R
180,Bohemian Rhapsody (2018),2018,"The story of the legendary British rock band Queen and lead singer Freddie Mercury, leading up to their famous performance at Live Aid.",Twentieth Century Fox,"$216,668,042.00","$694,141,269.00","$910,809,311.00",PG-13
181,Ant-Man and the Wasp (2018),2018,"As Scott Lang balances being both a superhero and a father, Hope van Dyne and Dr. Hank Pym present an urgent new mission that finds the Ant-Man fighting alongside The Wasp to uncover secrets from their past.",Walt Disney Studios Motion Pictures,"$216,648,740.00","$406,025,399.00","$622,674,139.00",PG-13
182,Madagascar 3: Europe's Most Wanted (2012),2012,"The Madagascar animals join a struggling European circus to get back to New York, but find themselves being pursued by a psychotic animal control officer.",DreamWorks,"$216,391,482.00","$530,529,792.00","$746,921,274.00",PG
183,Kung Fu Panda (2008),2008,"To everyone's surprise, including his own, Po, an overweight, clumsy panda, is chosen as protector of the Valley of Peace. His suitability will soon be tested as the valley's arch-enemy is on his way.",DreamWorks,"$215,434,591.00","$416,311,606.00","$631,746,197.00",PG
184,Mission: Impossible II (2000),2000,"IMF agent Ethan Hunt is sent to Sydney to find and destroy a genetically modified disease called ""Chimera"".",Paramount Pictures,"$215,409,889.00","$330,978,219.00","$546,388,108.00",PG-13
185,A Star Is Born (2018),2018,A musician helps a young singer find fame as age and alcoholism send his own career into a downward spiral.,Warner Bros.,"$215,288,866.00","$220,900,000.00","$436,188,866.00",R
186,X2: X-Men United (2003),2003,"When anti-mutant Colonel William Stryker kidnaps Professor X and attacks his school, the X-Men must ally with their archenemy Magneto to stop him.",Twentieth Century Fox,"$214,949,694.00","$192,761,855.00","$407,711,549.00",PG-13
187,The Lorax (2012),2012,"A 12-year-old boy searches for the one thing that will enable him to win the affection of the girl of his dreams. To find it he must discover the story of the Lorax, the grumpy yet charming creature who fights to protect his world.",Universal Pictures,"$214,030,500.00","$134,809,816.00","$348,840,316.00",PG
188,Solo: A Star Wars Story (2018),2018,"Board the Millennium Falcon and journey to a galaxy far, far away in an epic action-adventure that will set the course of one of the Star Wars saga's most unlikely heroes.",Walt Disney Studios Motion Pictures,"$213,767,512.00","$179,157,295.00","$392,924,807.00",PG-13
189,Venom (2018),2018,"A failed reporter is bonded to an alien entity, one of many symbiotes who have invaded Earth. But the being takes a liking to Earth and decides to protect it.",Sony Pictures Entertainment (SPE),"$213,515,506.00","$642,569,645.00","$856,085,151.00",PG-13
190,Austin Powers in Goldmember (2002),2002,"Upon learning that his father has been kidnapped, Austin Powers must travel to 1975 and defeat the aptly named villain Goldmember, who is working with Dr. Evil.",New Line Cinema,"$213,307,889.00","$83,630,912.00","$296,938,801.00",PG-13
191,Venom: Let There Be Carnage (2021),2021,"Eddie Brock attempts to reignite his career by interviewing serial killer Cletus Kasady, who becomes the host of the symbiote Carnage and escapes prison after a failed execution.",Sony Pictures Entertainment (SPE),"$212,638,437.00","$288,500,000.00","$501,138,437.00",PG-13
192,It Chapter Two (2019),2019,"Twenty-seven years after their first encounter with the terrifying Pennywise, the Losers Club have grown up and moved away, until a devastating phone call brings them back.",Warner Bros.,"$211,593,228.00","$261,500,000.00","$473,093,228.00",R
193,Back to the Future (1985),1985,"Marty McFly, a 17-year-old high school student, is accidentally sent thirty years into the past in a time-traveling DeLorean invented by his close friend, the eccentric scientist Doc Brown.",Universal Pictures,"$211,406,762.00","$170,500,000.00","$381,906,762.00",PG
194,300 (2006),2006,King Leonidas of Sparta and a force of 300 men fight the Persians at Thermopylae in 480 B.C.,Warner Bros.,"$210,614,939.00","$245,453,242.00","$456,068,181.00",R
195,Coco (2017),2017,"Aspiring musician Miguel, confronted with his family's ancestral ban on music, enters the Land of the Dead to find his great-great-grandfather, a legendary singer.",Walt Disney Studios Motion Pictures,"$210,460,015.00","$597,357,873.00","$807,817,888.00",PG
196,Fast Five (2011),2011,Dominic Toretto and his crew of street racers plan a massive heist to buy their freedom while in the sights of a powerful Brazilian drug lord and a dangerous federal agent.,Universal Pictures,"$209,837,675.00","$416,300,000.00","$626,137,675.00",PG-13
197,Mission: Impossible - Ghost Protocol (2011),2011,"The IMF is shut down when it's implicated in the bombing of the Kremlin, causing Ethan Hunt and his new team to go rogue to clear their organization's name.",Paramount Pictures,"$209,397,903.00","$485,315,477.00","$694,713,380.00",PG-13
198,Wedding Crashers (2005),2005,"John Beckwith and Jeremy Grey, a pair of committed womanizers who sneak into weddings to take advantage of the romantic tinge in the air, find themselves at odds with one another when John meets and falls for Claire Cleary.",New Line Cinema,"$209,255,921.00","$79,211,724.00","$288,467,645.00",R
199,Sherlock Holmes (2009),2009,Detective Sherlock Holmes and his stalwart partner Watson engage in a battle of wits and brawn with a nemesis whose plot is a threat to all of England.,Warner Bros.,"$209,028,679.00","$315,000,000.00","$524,028,679.00",PG-13
200,Dawn of the Planet of the Apes (2014),2014,A growing nation of genetically evolved apes led by Caesar is threatened by a band of human survivors of the devastating virus unleashed a decade earlier.,Twentieth Century Fox,"$208,545,589.00","$502,098,977.00","$710,644,566.00",PG-13
201,Batman Begins (2005),2005,"After training with his mentor, Batman begins his fight to free crime-ridden Gotham City from corruption.",Warner Bros.,"$206,852,432.00","$166,809,514.00","$373,661,946.00",PG-13
202,Charlie and the Chocolate Factory (2005),2005,"A young boy wins a tour through the most magnificent chocolate factory in the world, led by the world's most unusual candy maker.",Warner Bros.,"$206,459,076.00","$268,509,687.00","$474,968,763.00",PG
203,Ratatouille (2007),2007,A rat who can cook makes an unusual alliance with a young kitchen worker at a famous Paris restaurant.,Walt Disney Studios Motion Pictures,"$206,445,654.00","$417,280,431.00","$623,726,085.00",PG
204,Thor: The Dark World (2013),2013,"When the Dark Elves attempt to plunge the universe into darkness, Thor must embark on a perilous and personal journey that will reunite him with doctor Jane Foster.",Walt Disney Studios Motion Pictures,"$206,362,140.00","$438,421,000.00","$644,783,140.00",PG-13
205,Bad Boys for Life (2020),2020,Miami detectives Mike Lowrey and Marcus Burnett must face off against a mother-and-son pair of drug lords who wreak vengeful havoc on their city.,Sony Pictures Entertainment (SPE),"$206,305,244.00","$220,200,000.00","$426,505,244.00",R
206,Austin Powers: The Spy Who Shagged Me (1999),1999,"Dr. Evil is back and has invented a new time machine that allows him to go back to the 1960s and steal Austin Powers' mojo, inadvertently leaving him ""shagless"".",New Line Cinema,"$206,040,086.00","$105,976,842.00","$312,016,928.00",PG-13
207,Terminator 2: Judgment Day (1991),1991,"A cyborg, identical to the one who failed to kill Sarah Connor, must now protect her ten-year-old son John from a more advanced and powerful cyborg.",TriStar Pictures,"$205,881,154.00","$312,106,698.00","$520,881,154.00",R
208,The Amazing Spider-Man 2 (2014),2014,"When New York is put under siege by Oscorp, it is up to Spider-Man to save the city he swore to protect as well as his loved ones.",Sony Pictures Entertainment (SPE),"$202,853,933.00","$506,128,390.00","$708,982,323.00",PG-13
209,World War Z (2013),2013,Former United Nations employee Gerry Lane traverses the world in a race against time to stop a zombie pandemic that is toppling armies and governments and threatens to destroy humanity itself.,Paramount Pictures,"$202,807,711.00","$337,648,165.00","$540,455,876.00",PG-13
210,The Mummy Returns (2001),2001,"The mummified body of Imhotep is shipped to a museum in London, where he once again wakes and begins his campaign of rage and terror.",Universal Pictures,"$202,019,785.00","$241,261,119.00","$443,280,904.00",PG-13
211,Armageddon (1998),1998,"After discovering that an asteroid the size of Texas is going to impact Earth in less than a month, NASA recruits a misfit team of deep-core drillers to save the planet.",Walt Disney Studios Motion Pictures,"$201,578,182.00","$352,131,606.00","$553,709,788.00",PG-13
212,Cinderella (2015),2015,"When her father unexpectedly dies, young Ella finds herself at the mercy of her cruel stepmother and her scheming stepsisters. Never one to give up hope, Ella's fortunes begin to change after meeting a dashing stranger.",Walt Disney Studios Motion Pictures,"$201,151,353.00","$341,206,978.00","$542,358,331.00",PG
213,Ralph Breaks the Internet (2018),2018,"Six years after the events of ""Wreck-It Ralph,"" Ralph and Vanellope, now friends, discover a wi-fi router in their arcade, leading them into a new adventure.",Walt Disney Studios Motion Pictures,"$201,091,711.00","$328,232,251.00","$529,323,962.00",PG
214,Tangled (2010),2010,"The magically long-haired Rapunzel has spent her entire life in a tower, but now that a runaway thief has stumbled upon her, she is about to discover the world for the first time, and who she really is.",Walt Disney Studios Motion Pictures,"$200,821,936.00","$391,640,880.00","$592,462,816.00",PG
215,Godzilla (2014),2014,"The world is beset by the appearance of monstrous creatures, but one of them may be the only one who can save humanity.",Warner Bros.,"$200,676,069.00","$324,300,000.00","$524,976,069.00",PG-13
216,Superman Returns (2006),2006,"Superman returns to Earth after spending five years in space examining his homeworld Krypton. But he finds things have changed while he was gone, and he must once again prove himself important to the world.",Warner Bros.,"$200,081,192.00","$191,000,000.00","$391,081,192.00",PG-13
217,Spectre (2015),2015,"A cryptic message from James Bond's past sends him on a trail to uncover the existence of a sinister organisation named SPECTRE. With a new threat dawning, Bond learns the terrible truth about the author of all his pain in his most recent missions.",Sony Pictures Entertainment (SPE),"$200,074,609.00","$680,606,910.00","$880,681,519.00",PG-13
218,Pearl Harbor (2001),2001,A tale of war and romance mixed in with history. The story follows two lifelong friends and a beautiful nurse who are caught up in the horror of an infamous Sunday morning in 1941.,Walt Disney Studios Motion Pictures,"$198,542,554.00","$250,678,391.00","$449,220,945.00",PG-13
219,Monsters vs. Aliens (2009),2009,A woman transformed into a giant after she is struck by a meteorite on her wedding day becomes part of a team of monsters sent in by the U.S. government to defeat an alien mastermind trying to take over Earth.,DreamWorks,"$198,351,526.00","$183,158,344.00","$381,509,870.00",PG
220,Happy Feet (2006),2006,"Into the world of the Emperor Penguins, who find their soul mates through song, a penguin is born who cannot sing. But he can tap dance something fierce!",Warner Bros.,"$198,000,317.00","$186,335,791.00","$384,336,108.00",PG
221,Indiana Jones and the Last Crusade (1989),1989,"In 1938, after his father Professor Henry Jones, Sr. goes missing while pursuing the Holy Grail, Professor Henry ""Indiana"" Jones, Jr. finds himself up against Adolf Hitler's Nazis again to stop them from obtaining its powers.",Paramount Pictures,"$197,171,806.00","$277,000,000.00","$474,171,806.00",PG-13
222,Ice Age: Dawn of the Dinosaurs (2009),2009,"When Sid's attempt to adopt three dinosaur eggs gets him abducted by their real mother to an underground lost world, his friends attempt to rescue him.",Twentieth Century Fox,"$196,573,705.00","$690,113,112.00","$886,686,817.00",PG
223,Ice Age: The Meltdown (2006),2006,"Manny, Sid, and Diego discover that the ice age is coming to an end, and join everybody for a journey to higher ground. On the trip, they discover that Manny, in fact, is not the last of the woolly mammoths.",Twentieth Century Fox,"$195,330,621.00","$471,763,885.00","$667,094,506.00",PG
224,Mission: Impossible - Rogue Nation (2015),2015,Ethan and his team take on their most impossible mission yet when they have to eradicate an international rogue organization as highly skilled as they are and committed to destroying the IMF.,Paramount Pictures,"$195,042,377.00","$487,674,259.00","$682,716,636.00",PG-13
225,Twilight (2008),2008,"When Bella Swan moves to a small town in the Pacific Northwest, she falls in love with Edward Cullen, a mysterious classmate who reveals himself to be a 108-year-old vampire.",Summit Entertainment,"$193,962,473.00","$214,467,942.00","$408,430,415.00",PG-13
226,Men in Black II (2002),2002,Agent Jay is sent to find Agent Kay and restore his memory after the re-appearance of a case from Kay's past.,Sony Pictures Entertainment (SPE),"$193,735,288.00","$251,400,000.00","$445,135,288.00",PG-13
227,Madagascar (2005),2005,"A group of animals who have spent all their life in a New York zoo end up in the jungles of Madagascar, and must adjust to living in the wild.",DreamWorks Distribution,"$193,595,521.00","$348,468,325.00","$542,063,846.00",PG
228,22 Jump Street (2014),2014,"After making their way through high school (twice), big changes are in store for officers Schmidt and Jenko when they go deep undercover at a local college.",Sony Pictures Entertainment (SPE),"$191,719,337.00","$139,614,539.00","$331,333,876.00",R
229,Cars 2 (2011),2011,Star race car Lightning McQueen and his pal Mater head overseas to compete in the World Grand Prix race. But the road to the championship becomes rocky as Mater gets caught up in an intriguing adventure of his own: international espionage.,Walt Disney Studios Motion Pictures,"$191,452,396.00","$368,400,000.00","$559,852,396.00",PG
230,Teenage Mutant Ninja Turtles (2014),2014,"When a kingpin threatens New York City, a group of mutated turtle warriors must emerge from the shadows to protect their home.",Paramount Pictures,"$191,204,754.00","$293,800,000.00","$485,004,754.00",PG-13
231,Spider-Man: Into the Spider-Verse (2018),2018,"Teen Miles Morales becomes the Spider-Man of his universe, and must join with five spider-powered individuals from other dimensions to stop a threat for all realities.",Sony Pictures Entertainment (SPE),"$190,241,310.00","$185,299,521.00","$375,540,831.00",PG
232,Grease (1978),1978,"Good girl Sandy Olsson and greaser Danny Zuko fell in love over the summer. When they unexpectedly discover they're now in the same high school, will they be able to rekindle their romance?",Paramount Pictures,"$190,071,103.00","$206,200,000.00","$396,271,103.00",PG
233,Dunkirk (2017),2017,"Allied soldiers from Belgium, the British Commonwealth and Empire, and France are surrounded by the German Army and evacuated during a fierce battle in World War II.",Warner Bros.,"$189,740,665.00","$337,275,642.00","$527,016,307.00",PG-13
234,Wreck-It Ralph (2012),2012,"A video game villain wants to be a hero and sets out to fulfill his dream, but his quest brings havoc to the whole arcade where he lives.",Walt Disney Studios Motion Pictures,"$189,422,889.00","$281,800,000.00","$471,222,889.00",PG
235,A Quiet Place (2018),2018,"In a post-apocalyptic world, a family is forced to live in silence while hiding from monsters with ultra-sensitive hearing.",Paramount Pictures,"$188,024,361.00","$152,928,610.00","$340,952,971.00",PG-13
236,Interstellar (2014),2014,A team of explorers travel through a wormhole in space in an attempt to ensure humanity's survival.,Paramount Pictures,"$188,020,017.00","$513,709,189.00","$701,729,206.00",PG-13
237,The Polar Express (2004),2004,"On Christmas Eve, a young boy embarks on a magical adventure to the North Pole on the Polar Express, while learning about friendship, bravery, and the spirit of Christmas.",Warner Bros.,"$187,935,490.00","$126,279,964.00","$314,215,454.00",PG
238,Gladiator (2000),2000,A former Roman General sets out to exact vengeance against the corrupt emperor who murdered his family and sent him into slavery.,DreamWorks Distribution,"$187,705,427.00","$277,675,375.00","$465,380,802.00",R
239,The Croods (2013),2013,"After their cave is destroyed, a caveman family must trek through an unfamiliar fantastical world with the help of an inventive boy.",Twentieth Century Fox,"$187,168,425.00","$400,067,558.00","$587,235,983.00",PG
240,Sherlock Holmes: A Game of Shadows (2011),2011,"Detective Sherlock Holmes is on the trail of criminal mastermind Professor Moriarty, who is carrying out a string of random crimes across Europe.",Warner Bros.,"$186,848,418.00","$357,000,000.00","$543,848,418.00",PG-13
241,The Day After Tomorrow (2004),2004,"Jack Hall, paleoclimatologist, must make a daring trek from Washington, D.C. to New York City to reach his son, trapped in the cross-hairs of a sudden international storm which plunges the planet into a new Ice Age.",Twentieth Century Fox,"$186,740,799.00","$365,898,772.00","$552,639,571.00",PG-13
242,Mr. & Mrs. Smith (2005),2005,A bored married couple is surprised to learn that they are both assassins hired by competing agencies to kill each other.,Twentieth Century Fox,"$186,336,279.00","$300,951,367.00","$487,287,646.00",PG-13
243,Snow White and the Seven Dwarfs (1937),1937,"Exiled into the dangerous forest by her wicked stepmother, a princess is rescued by seven dwarf miners who make her part of their household.",Walt Disney Studios Motion Pictures,"$184,925,486.00","$184,925,486.00","$184,925,486.00",PG
244,Pitch Perfect 2 (2015),2015,"After a humiliating command performance at The Kennedy Center, the Barden Bellas enter an international competition that no American group has ever won in order to regain their status and right to perform.",Universal Pictures,"$184,296,230.00","$102,847,849.00","$287,144,079.00",PG-13
245,Dances with Wolves (1990),1990,"Lieutenant John Dunbar, assigned to a remote western Civil War outpost, befriends wolves and Native Americans, making him an intolerable aberration in the military.",Orion Pictures,"$184,208,848.00","$240,000,000.00","$424,208,848.00",PG
246,Batman Forever (1995),1995,"Batman must battle former district attorney Harvey Dent, who is now Two-Face and Edward Nygma, The Riddler with help from an amorous psychologist and a young circus acrobat who becomes his sidekick, Robin.",Warner Bros.,"$184,069,126.00","$152,498,032.00","$336,567,158.00",PG-13
247,The Fugitive (1993),1993,"Dr. Richard Kimble, unjustly accused of murdering his wife, must find the real killer while being the target of a nationwide manhunt led by a seasoned U.S. Marshal.",Warner Bros.,"$183,875,760.00","$185,000,000.00","$368,875,760.00",PG
248,Black Widow (2021),2021,Natasha Romanoff confronts the darker parts of her ledger when a dangerous conspiracy with ties to her past arises.,Walt Disney Studios Motion Pictures,"$183,651,655.00","$195,979,696.00","$379,631,351.00",PG-13
249,The Revenant (2015),2015,A frontiersman on a fur trading expedition in the 1820s fights for survival after being mauled by a bear and left for dead by members of his own hunting team.,Twentieth Century Fox,"$183,637,894.00","$349,312,609.00","$532,950,503.00",R
250,Ocean's Eleven (2001),2001,Danny Ocean and his ten accomplices plan to rob three Las Vegas casinos simultaneously.,Warner Bros.,"$183,417,150.00","$267,300,000.00","$450,717,150.00",PG-13
251,The Simpsons Movie (2007),2007,"After Homer pollutes the town's water supply, Springfield is encased in a gigantic dome by the EPA and the Simpsons are declared fugitives.",Twentieth Century Fox,"$183,135,014.00","$353,279,279.00","$536,414,293.00",PG-13
252,What Women Want (2000),2000,"A cocky, chauvinistic advertising executive magically acquires the ability to hear what women are thinking.",Paramount Pictures,"$182,811,707.00","$191,300,000.00","$374,111,707.00",PG-13
253,The Perfect Storm (2000),2000,An unusually intense storm pattern catches some commercial fishermen unaware and puts them in mortal danger.,Warner Bros.,"$182,618,434.00","$146,100,000.00","$328,718,434.00",PG-13
254,Lincoln (2012),2012,"As the American Civil War continues to rage, America's president struggles with continuing carnage on the battlefield as he fights with many inside his own cabinet on the decision to emancipate the slaves.",Walt Disney Studios Motion Pictures,"$182,207,973.00","$93,085,477.00","$275,293,450.00",PG-13
255,Liar Liar (1997),1997,A fast-track lawyer can't lie for 24 hours due to his son's birthday wish after he disappoints his son for the last time.,Universal Pictures,"$181,410,615.00","$121,300,000.00","$302,710,615.00",PG
256,Jurassic Park III (2001),2001,"A decidedly odd couple with ulterior motives convince Dr. Grant to go to Isla Sorna for a holiday, but their unexpected landing startles the island's new inhabitants.",Universal Pictures,"$181,171,875.00","$187,608,934.00","$368,780,809.00",PG-13
257,Thor (2011),2011,"The powerful but arrogant god Thor is cast out of Asgard to live amongst humans in Midgard (Earth), where he soon becomes one of their finest defenders.",Paramount Pictures,"$181,030,624.00","$268,295,994.00","$449,326,618.00",PG-13
258,Mission: Impossible (1996),1996,"An American agent, under false suspicion of disloyalty, must discover and expose the real spy without the help of his organization.",Paramount Pictures,"$180,981,856.00","$276,714,535.00","$457,696,391.00",PG-13
259,Ant-Man (2015),2015,"Armed with a super-suit with the astonishing ability to shrink in scale but increase in strength, cat burglar Scott Lang must embrace his inner hero and help his mentor, Dr. Hank Pym, pull off a plan that will save the world.",Walt Disney Studios Motion Pictures,"$180,202,163.00","$339,109,802.00","$519,311,965.00",PG-13
260,Planet of the Apes (2001),2001,"In 2029, an Air Force astronaut crash-lands on a mysterious planet where evolved, talking apes dominate a race of primitive humans.",Twentieth Century Fox,"$180,011,740.00","$182,200,000.00","$362,211,740.00",PG-13
261,Madagascar: Escape 2 Africa (2008),2008,"The Madagascar animals fly back to New York City, but crash-land on an African nature reserve, where they meet others of their own kind, and Alex especially discovers his royal heritage as prince of a lion pride.",DreamWorks,"$180,010,950.00","$423,889,404.00","$603,900,354.00",PG
262,X-Men Origins: Wolverine (2009),2009,"The early years of James Logan, featuring his rivalry with his brother Victor Creed, his service in the special forces team Weapon X, and his experimentation into the metal-lined mutant Wolverine.",Twentieth Century Fox,"$179,883,157.00","$193,179,707.00","$373,062,864.00",PG-13
263,Indiana Jones and the Temple of Doom (1984),1984,"In 1935, Indiana Jones arrives in India, still part of the British Empire, and is asked to find a mystical stone. He then stumbles upon a secret cult committing enslavement and human sacrifices in the catacombs of an ancient palace.",Paramount Pictures,"$179,870,271.00","$153,237,000.00","$333,107,271.00",PG-13
264,Hitch (2005),2005,A smooth-talking man falls for a hardened columnist while helping a shy accountant woo a beautiful heiress.,Sony Pictures Entertainment (SPE),"$179,495,555.00","$192,098,655.00","$371,594,210.00",PG-13
265,Men in Black 3 (2012),2012,Agent J travels in time to M.I.B.'s early days in 1969 to stop an alien from assassinating his friend Agent K and changing history.,Sony Pictures Entertainment (SPE),"$179,020,854.00","$445,005,922.00","$624,026,776.00",PG-13
266,Pretty Woman (1990),1990,"A man in a legal but hurtful business needs an escort for some social events, and hires a beautiful prostitute he meets... only to fall in love.",Walt Disney Studios Motion Pictures,"$178,406,268.00","$285,000,000.00","$463,406,268.00",R
267,Home (2015),2015,"An alien on the run from his own people makes friends with a girl. He tries to help her on her quest, but can be an interference.",Twentieth Century Fox,"$177,397,510.00","$208,644,097.00","$386,041,607.00",PG
268,Night at the Museum: Battle of the Smithsonian (2009),2009,"Security guard Larry Daley infiltrates the Smithsonian Institution in order to rescue Jedediah and Octavius, who have been shipped to the museum by mistake.",Twentieth Century Fox,"$177,243,721.00","$235,862,449.00","$413,106,170.00",PG
269,Tootsie (1982),1982,"Michael Dorsey, an unsuccessful actor, disguises himself as a woman in order to get a role on a trashy hospital soap.",Columbia Pictures,"$177,200,000.00","$177,200,000.00","$177,200,000.00",PG
