No.,Title,Release Year,Movie Info,Distributor,Domestic Sales (in $),International Sales (in $),World Sales (in $),License
647,The Lego Movie 2: The Second Part (2019),2019,"It's been five years since everything was awesome and the citizens are facing a huge new threat: Lego Duplo invaders from outer space, wrecking everything faster than they can rebuild.",Warner Bros.,"$105,806,508.00","$86,500,000.00","$192,306,508.00",PG
648,The First Wives Club (1996),1996,"Reunited by the death of a college friend, three divorced women seek revenge on the husbands who left them for younger women.",Paramount Pictures,"$105,489,203.00","$76,000,000.00","$181,489,203.00",PG
649,Robin Hood (2010),2010,"In twelfth-century England, Robin Longstride and his band of marauders confront corruption in a local village and lead an uprising against the crown that will forever alter the balance of world power.",Universal Pictures,"$105,269,730.00","$216,400,011.00","$321,669,741.00",PG-13
650,Interview with the Vampire: The Vampire Chronicles (1994),1994,"A vampire tells his epic life story: love, betrayal, loneliness, and hunger.",Warner Bros.,"$105,264,608.00","$118,400,000.00","$223,664,608.00",R
651,George of the Jungle (1997),1997,A man raised in the jungle by apes falls in love with a wealthy American heiress.,Walt Disney Studios Motion Pictures,"$105,263,257.00","$69,200,000.00","$174,463,257.00",PG
652,Hustlers (2019),2019,"Inspired by the viral New York Magazine article, Hustlers follows a crew of savvy former strip club employees who band together to turn the tables on their Wall Street clients.",STX Entertainment,"$104,963,598.00","$52,600,000.00","$157,563,598.00",R
653,Pitch Perfect 3 (2017),2017,"Following their win at the world championship, the now separated Bellas reunite for one last singing competition at an overseas USO tour, but face a group who uses both instruments and voices.",Universal Pictures,"$104,897,530.00","$80,502,815.00","$185,400,345.00",PG-13
654,Phenomenon (1996),1996,"An ordinary man sees a bright light descend from the sky, and discovers he now has super-intelligence and telekinesis.",Walt Disney Studios Motion Pictures,"$104,636,382.00","$47,400,000.00","$152,036,382.00",PG
655,American Wedding (2003),2003,"It's the wedding of Jim and Michelle and the gathering of their families and friends, including Jim's old friends from high school and Michelle's little sister.",Universal Pictures,"$104,565,114.00","$128,157,821.00","$232,722,935.00",R
656,Road to Perdition (2002),2002,"A mob enforcer's son in 1930s Illinois witnesses a murder, forcing him and his father to take to the road, and his father down a path of redemption and revenge.",DreamWorks Distribution,"$104,454,762.00","$76,546,716.00","$181,001,478.00",R
657,The Princess and the Frog (2009),2009,"A waitress, desperate to fulfill her dreams as a restaurant owner, is set on a journey to turn a frog prince back into a human being, but she has to face the same problem after she kisses him.",Walt Disney Studios Motion Pictures,"$104,400,899.00","$162,644,866.00","$267,045,765.00",PG
658,The Chronicles of Narnia: The Voyage of the Dawn Treader (2010),2010,"Lucy and Edmund Pevensie return to Narnia with their cousin Eustace where they meet up with Prince Caspian for a trip across the sea aboard the royal ship The Dawn Treader. Along the way they encounter dragons, dwarves, merfolk, and a band of lost warriors before reaching the edge of the world.",Twentieth Century Fox,"$104,386,950.00","$311,299,267.00","$415,686,217.00",PG
659,Daddy Day Care (2003),2003,"Two men, Charlie Hinton (Eddie Murphy) and Phil Ryerson (Jeff Garlin), get laid off and have to become stay-at-home dads when they can't find jobs. This inspires them to open their own day-care center.",Revolution Studios,"$104,297,061.00","$60,136,806.00","$164,433,867.00",PG
660,Daddy's Home 2 (2017),2017,"Having finally gotten used to each other's existence, Brad and Dusty must now deal with their intrusive fathers during the holidays.",Paramount Pictures,"$104,029,443.00","$76,584,381.00","$180,613,824.00",PG-13
661,Paranormal Activity 3 (2011),2011,"In 1988, young sisters Katie and Kristi befriend an invisible entity who resides in their home.",Paramount Pictures,"$104,028,807.00","$103,011,037.00","$207,039,844.00",R
662,Journey 2: The Mysterious Island (2012),2012,"Sean Anderson partners with his mom's husband on a mission to find his grandfather, who is thought to be missing on a mythical island.",Warner Bros.,"$103,860,290.00","$231,400,000.00","$335,260,290.00",PG
663,The Mule (2018),2018,A ninety-year-old horticulturist and Korean War veteran turns drug mule for a Mexican cartel.,Warner Bros.,"$103,804,407.00","$71,000,000.00","$174,804,407.00",R
664,Dick Tracy (1990),1990,The comic strip detective finds his life vastly complicated when Breathless Mahoney makes advances towards him while he is trying to battle Big Boy Caprice's united mob.,Walt Disney Studios Motion Pictures,"$103,738,726.00","$59,000,000.00","$162,738,726.00",PG
665,Rise of the Guardians (2012),2012,"When the evil spirit Pitch launches an assault on Earth, the Immortal Guardians team up to protect the innocence of children all around the world.",DreamWorks,"$103,412,758.00","$203,528,912.00","$306,941,670.00",PG
666,Dreamgirls (2006),2006,"A trio of black female soul singers cross over to the pop charts in the early 1960s, facing their own personal struggles along the way.",DreamWorks,"$103,365,956.00","$52,064,379.00","$155,430,335.00",PG
667,Independence Day: Resurgence (2016),2016,"Two decades after the first Independence Day invasion, Earth is faced with a new extra-Solar threat. But will mankind's new space defenses be enough?",Twentieth Century Fox,"$103,144,286.00","$286,537,649.00","$389,681,935.00",PG-13
668,The Expendables (2010),2010,A CIA operative hires a team of mercenaries to eliminate a Latin dictator and a renegade CIA agent.,Lionsgate,"$103,068,524.00","$171,401,870.00","$274,470,394.00",R
669,Scream (1996),1996,"A year after the murder of her mother, a teenage girl is terrorized by a new killer, who targets the girl and her friends by using horror films as part of a deadly game.",Dimension Films,"$103,046,663.00","$70,000,000.00","$173,046,663.00",R
670,Just Go with It (2011),2011,"On a weekend trip to Hawaii, a plastic surgeon convinces his loyal assistant to pose as his soon-to-be-divorced wife in order to cover up a careless lie he told to his much-younger girlfriend.",Sony Pictures Entertainment (SPE),"$103,028,109.00","$111,917,482.00","$214,945,591.00",PG-13
671,Murder on the Orient Express (2017),2017,"When a murder occurs on the train on which he's travelling, celebrated detective Hercule Poirot is recruited to solve the case.",Twentieth Century Fox,"$102,826,543.00","$249,967,538.00","$352,794,081.00",PG-13
672,The General's Daughter (1999),1999,"When the daughter of a well-known and well-respected base commander is murdered, an undercover detective is summoned to look into the matter and finds a slew of cover-ups at West Point.",Paramount Pictures,"$102,705,852.00","$47,000,000.00","$149,705,852.00",R
673,The Aviator (2004),2004,A biopic depicting the early years of legendary director and aviator Howard Hughes' career from the late 1920s to the mid 1940s.,Miramax,"$102,610,330.00","$111,109,612.00","$213,719,942.00",PG-13
674,American Pie (1999),1999,Four teenage boys enter a pact to lose their virginity by prom night.,Universal Pictures,"$102,561,004.00","$132,922,000.00","$235,483,004.00",R
675,Daredevil (2003),2003,A man blinded by toxic waste which also enhanced his remaining senses fights crime as an acrobatic martial arts superhero.,Twentieth Century Fox,"$102,543,518.00","$76,636,200.00","$179,179,718.00",PG-13
676,The Girl with the Dragon Tattoo (2011),2011,"Journalist Mikael Blomkvist is aided in his search for a woman who has been missing for forty years by Lisbeth Salander, a young computer hacker.",Sony Pictures Entertainment (SPE),"$102,515,793.00","$130,101,637.00","$232,617,430.00",R
677,The Mummy: Tomb of the Dragon Emperor (2008),2008,"In the Far East, Alex O'Connell, the son of famed mummy fighters Rick and Evy O'Connell, unearths the mummy of the first Emperor of Qin -- a shape-shifting entity cursed by a witch centuries ago.",Universal Pictures,"$102,491,776.00","$300,958,054.00","$403,449,830.00",PG-13
678,The Conjuring 2 (2016),2016,Ed and Lorraine Warren travel to North London to help a single mother raising four children alone in a house plagued by a supernatural spirit.,Warner Bros.,"$102,470,008.00","$219,318,211.00","$321,788,219.00",R
679,The Maze Runner (2014),2014,"Thomas is deposited in a community of boys after his memory is erased, soon learning they're all trapped in a maze that will require him to join forces with fellow ""runners"" for a shot at escape.",Twentieth Century Fox,"$102,427,862.00","$245,891,999.00","$348,319,861.00",PG-13
680,In the Line of Fire (1993),1993,"Secret Service agent Frank Horrigan (Clint Eastwood) couldn't save Kennedy, but he's determined not to let a clever assassin take out this president.",Columbia Pictures,"$102,314,823.00","$74,682,345.00","$176,997,168.00",R
681,Annabelle: Creation (2017),2017,"Twelve years after the tragic death of their little girl, a doll-maker and his wife welcome a nun and several girls from a shuttered orphanage into their home, where they become the target of the doll-maker's possessed creation, Annabelle.",Warner Bros.,"$102,092,201.00","$204,423,683.00","$306,515,884.00",R
682,The Equalizer 2 (2018),2018,"Robert McCall serves an unflinching justice for the exploited and oppressed, but how far will he go when that is someone he loves?",Sony Pictures Entertainment (SPE),"$102,084,362.00","$88,315,795.00","$190,400,157.00",R
683,Bad Grandpa (2013),2013,"86-year-old Irving Zisman takes a trip from Nebraska to North Carolina to take his 8 year-old grandson, Billy, back to his real father.",Paramount Pictures,"$102,003,019.00","$49,823,528.00","$151,826,547.00",R
684,Pacific Rim (2013),2013,"As a war between humankind and monstrous sea creatures wages on, a former pilot and a trainee are paired up to drive a seemingly obsolete special weapon in a desperate effort to save the world from the apocalypse.",Warner Bros.,"$101,802,906.00","$309,200,000.00","$411,002,906.00",PG-13
685,Journey to the Center of the Earth (2008),2008,"On a quest to find out what happened to his missing brother, a scientist, his nephew and their mountain guide discover a fantastic and dangerous lost world in the center of the earth.",Warner Bros.,"$101,704,370.00","$142,528,318.00","$244,232,688.00",PG
686,Gone in 60 Seconds (2000),2000,A retired master car thief must come back to the industry and steal fifty cars with his crew in one night to save his brother's life.,Walt Disney Studios Motion Pictures,"$101,648,571.00","$135,553,728.00","$237,202,299.00",PG-13
687,Maverick (1994),1994,"Bret Maverick, needing money for a poker tournament, faces various comic mishaps and challenges, including a charming woman thief.",Warner Bros.,"$101,631,272.00","$81,400,000.00","$183,031,272.00",PG-13
688,Sleeping with the Enemy (1991),1991,"A young woman fakes her own death in an attempt to escape her nightmarish marriage, but discovers it is impossible to elude her controlling husband.",Twentieth Century Fox,"$101,599,005.00","$73,400,000.00","$174,999,005.00",R
689,The Equalizer (2014),2014,A man who believes he has put his mysterious past behind him cannot stand idly by when he meets a young girl under the control of ultra-violent Russian gangsters.,Sony Pictures Entertainment (SPE),"$101,530,738.00","$90,800,000.00","$192,330,738.00",R
690,This Is the End (2013),2013,"Six Los Angeles celebrities are stuck in James Franco's house after a series of devastating events just destroyed the city. Inside, the group not only have to face the apocalypse, but themselves.",Sony Pictures Entertainment (SPE),"$101,470,202.00","$24,571,120.00","$126,041,322.00",R
691,Eagle Eye (2008),2008,"Jerry and Rachel are two strangers thrown together by a mysterious phone call from a woman they have never met. Threatening their lives and family, she pushes Jerry and Rachel into a series of increasingly dangerous situations, using the technology of everyday life to track and control their every move.",DreamWorks,"$101,440,743.00","$77,326,640.00","$178,767,383.00",PG-13
692,The Prince of Egypt (1998),1998,Egyptian Prince Moses learns of his identity as a Hebrew and his destiny to become the chosen deliverer of his people.,DreamWorks Distribution,"$101,413,188.00","$117,200,000.00","$218,613,188.00",PG
693,Scream 2 (1997),1997,"Two years after the first series of murders, as Sidney acclimates to college life, someone donning the Ghostface costume begins a new string of killings.",Dimension Films,"$101,363,301.00","$71,000,000.00","$172,363,301.00",R
694,Eraser (1996),1996,A Witness Protection specialist becomes suspicious of his co-workers when dealing with a case involving high-tech weapons.,Warner Bros.,"$101,295,562.00","$141,000,000.00","$242,295,562.00",R
695,Noah (2014),2014,Noah is chosen by God to undertake a momentous mission before an apocalyptic flood cleanses the world.,Paramount Pictures,"$101,200,044.00","$258,000,000.00","$359,200,044.00",PG-13
696,Unforgiven (1992),1992,"Retired Old West gunslinger William Munny reluctantly takes on one last job, with the help of his old partner Ned Logan and a young man, The ""Schofield Kid.""",Warner Bros.,"$101,157,447.00","$58,000,000.00","$159,157,447.00",PG
697,The Cat in the Hat (2003),2003,Two bored children have their lives turned upside down when a talking cat comes to visit them.,Universal Pictures,"$101,149,285.00","$32,811,256.00","$133,960,541.00",PG
698,Con Air (1997),1997,Newly paroled ex-con and former U.S. Ranger Cameron Poe finds himself trapped in a prisoner transport plane when the passengers seize control.,Walt Disney Studios Motion Pictures,"$101,117,573.00","$122,894,661.00","$224,012,234.00",R
699,Sleepy Hollow (1999),1999,"Ichabod Crane is sent to Sleepy Hollow to investigate the decapitations of three people, with the culprit being the legendary apparition, The Headless Horseman.",Paramount Pictures,"$101,071,502.00","$105,000,000.00","$206,071,502.00",R
700,Rampage (2018),2018,"When three different animals become infected with a dangerous pathogen, a primatologist and a geneticist team up to stop them from destroying Chicago.",Warner Bros.,"$101,028,233.00","$327,000,000.00","$428,028,233.00",PG-13
701,Collateral (2004),2004,A cab driver finds himself the hostage of an engaging contract killer as he makes his rounds from hit to hit during one night in Los Angeles.,DreamWorks Distribution,"$101,005,703.00","$119,234,222.00","$220,239,925.00",R
702,Contact (1997),1997,"Dr. Ellie Arroway, after years of searching, finds conclusive radio proof of extraterrestrial intelligence, sending plans for a mysterious machine.",Warner Bros.,"$100,920,329.00","$70,200,000.00","$171,120,329.00",PG
703,Charlie's Angels: Full Throttle (2003),2003,The Angels investigate a series of murders which occur after the theft of a witness protection profile database.,Sony Pictures Entertainment (SPE),"$100,830,111.00","$158,345,677.00","$259,175,788.00",PG-13
704,The Pelican Brief (1993),1993,"A law student uncovers a conspiracy, putting herself and others in danger.",Warner Bros.,"$100,768,056.00","$94,500,000.00","$195,268,056.00",PG
705,The Addams Family (2019),2019,The eccentrically macabre family moves to a bland suburb where Wednesday Addams' friendship with the daughter of a hostile and conformist local reality show host exacerbates conflict between the families.,United Artists Releasing,"$100,723,831.00","$103,060,014.00","$203,783,845.00",PG
706,Vanilla Sky (2001),2001,A self-indulgent and vain publishing magnate finds his privileged life upended after a vehicular accident with a resentful lover.,Paramount Pictures,"$100,618,344.00","$102,769,997.00","$203,388,341.00",R
707,Godzilla vs. Kong (2021),2021,The epic next chapter in the cinematic Monsterverse pits two of the greatest icons in motion picture history against one another - the fearsome Godzilla and the mighty Kong - with humanity caught in the balance.,Warner Bros.,"$100,563,133.00","$367,300,000.00","$467,863,133.00",PG-13
708,Arrival (2016),2016,A linguist works with the military to communicate with alien lifeforms after twelve mysterious spacecraft appear around the world.,Paramount Pictures,"$100,546,139.00","$102,842,047.00","$203,388,186.00",PG-13
709,Due Date (2010),2010,High-strung father-to-be Peter Highman is forced to hitch a ride with aspiring actor Ethan Tremblay on a road trip in order to make it to his child's birth on time.,Warner Bros.,"$100,539,043.00","$111,241,781.00","$211,780,824.00",R
710,Jumanji (1995),1995,"When two kids find and play a magical board game, they release a man trapped in it for decades - and a host of dangers that can only be stopped by finishing the game.",Sony Pictures Entertainment (SPE),"$100,499,940.00","$162,322,000.00","$262,821,940.00",PG
711,The Rugrats Movie (1998),1998,The babies gets lost in the forest after Tommy Pickles (Elizabeth Daily) gets a new baby brother.,Paramount Pictures,"$100,494,675.00","$40,400,000.00","$140,894,675.00",PG
712,Million Dollar Baby (2004),2004,A determined woman works with a hardened boxing trainer to become a professional.,Warner Bros.,"$100,492,203.00","$116,271,443.00","$216,763,646.00",PG-13
713,A Wrinkle in Time (2018),2018,"After the disappearance of her scientist father, three peculiar beings send Meg, her brother, and her friend to space in order to find him.",Walt Disney Studios Motion Pictures,"$100,478,608.00","$32,197,256.00","$132,675,864.00",PG
714,Step Brothers (2008),2008,Two aimless middle-aged losers still living at home are forced against their will to become roommates when their parents marry.,Sony Pictures Entertainment (SPE),"$100,468,793.00","$27,639,418.00","$128,108,211.00",R
715,Evan Almighty (2007),2007,God contacts Congressman Evan Baxter and tells him to build an ark in preparation for a great flood.,Universal Pictures,"$100,462,298.00","$73,978,426.00","$174,440,724.00",PG
716,Fifty Shades Freed (2018),2018,"Anastasia and Christian get married, but Jack Hyde continues to threaten their relationship.",Universal Pictures,"$100,407,760.00","$271,580,078.00","$371,987,838.00",R
717,Casper (1995),1995,An afterlife therapist and his daughter meet a friendly young ghost when they move into a crumbling mansion in order to rid the premises of wicked spirits.,Universal Pictures,"$100,328,194.00","$187,600,000.00","$287,928,194.00",PG
718,Shakespeare in Love (1998),1998,"The world's greatest ever playwright, William Shakespeare, is young, out of ideas and short of cash, but meets his ideal woman and is inspired to write one of his most famous plays.",Miramax,"$100,317,794.00","$189,000,000.00","$289,317,794.00",R
719,Bad Teacher (2011),2011,"A lazy, incompetent middle school teacher who hates her job, her students, and her co-workers is forced to return to teaching to make enough money for breast implants after her wealthy fiancé dumps her.",Sony Pictures Entertainment (SPE),"$100,292,856.00","$115,904,636.00","$216,197,492.00",R
720,Yogi Bear (2010),2010,"A documentary filmmaker travels to Jellystone Park to shoot a project and soon crosses paths with Yogi Bear, his sidekick Boo-Boo and Ranger Smith.",Warner Bros.,"$100,246,011.00","$103,263,363.00","$203,509,374.00",PG
721,Cowboys & Aliens (2011),2011,"A spaceship arrives in Arizona, 1873, to take over the Earth, starting with the Wild West region. A posse of cowboys and natives are all that stand in their way.",Universal Pictures,"$100,240,551.00","$74,581,774.00","$174,822,325.00",PG-13
722,Kingsman: The Golden Circle (2017),2017,"After the Kingsman's headquarters are destroyed and the world is held hostage, an allied spy organisation in the United States is discovered. These two elite secret organisations must band together to defeat a common enemy.",Twentieth Century Fox,"$100,234,838.00","$310,667,824.00","$410,902,662.00",R
723,Edge of Tomorrow (2014),2014,"A soldier fighting aliens gets to relive the same day over and over again, the day restarting every time he dies.",Warner Bros.,"$100,206,256.00","$270,335,000.00","$370,541,256.00",PG-13
724,The Hunchback of Notre Dame (1996),1996,"A deformed bell-ringer must assert his independence from a vicious government minister in order to help his friend, a gypsy dancer.",Walt Disney Studios Motion Pictures,"$100,138,851.00","$225,200,000.00","$325,338,851.00",PG
725,Se7en (1995),1995,"Two detectives, a rookie and a veteran, hunt a serial killer who uses the seven deadly sins as his motives.",New Line Cinema,"$100,125,643.00","$227,207,916.00","$327,333,559.00",R
726,You Don't Mess with the Zohan (2008),2008,An Israeli Special Forces Soldier fakes his death so he can re-emerge in New York City as a hair stylist.,Sony Pictures Entertainment (SPE),"$100,018,837.00","$104,294,563.00","$204,313,400.00",PG-13
727,Passengers (2016),2016,A malfunction in a sleeping pod on a spacecraft traveling to a distant colony planet wakes one passenger 90 years early.,Sony Pictures Entertainment (SPE),"$100,014,699.00","$203,129,453.00","$303,144,152.00",PG-13
728,Die Hard with a Vengeance (1995),1995,"John McClane and a Harlem store owner are targeted by German terrorist Simon in New York City, where he plans to rob the Federal Reserve Building.",Twentieth Century Fox,"$100,012,499.00","$266,089,167.00","$366,101,666.00",R
729,Christopher Robin (2018),2018,"A working-class family man, Christopher Robin, encounters his childhood friend Winnie-the-Pooh, who helps him to rediscover the joys of life.",Walt Disney Studios Motion Pictures,"$99,215,042.00","$98,529,335.00","$197,744,377.00",PG
730,Hercules (1997),1997,The son of Zeus and Hera is stripped of his immortality as an infant and must become a true hero in order to reclaim it.,Walt Disney Studios Motion Pictures,"$99,112,101.00","$153,600,000.00","$252,712,101.00",PG
731,Olympus Has Fallen (2013),2013,Secret Service agent Mike Banning finds himself trapped inside the White House in the wake of a terrorist attack and works with national security to rescue the President from his kidnappers.,FilmDistrict,"$98,925,640.00","$71,344,561.00","$170,270,201.00",R
732,The Green Hornet (2011),2011,"Following the death of his father, Britt Reid, heir to his father's large company, teams up with his late dad's assistant Kato to become a masked crime fighting team.",Sony Pictures Entertainment (SPE),"$98,780,042.00","$129,037,206.00","$227,817,248.00",PG-13
733,Date Night (2010),2010,"In New York City, a case of mistaken identity turns a bored married couple's attempt at a glamorous and romantic evening into something more thrilling and dangerous.",Twentieth Century Fox,"$98,711,404.00","$53,552,476.00","$152,263,880.00",PG-13
734,Meet the Robinsons (2007),2007,"Lewis is a brilliant inventor who meets mysterious stranger named Wilbur Robinson, whisking Lewis away in a time machine and together they team up to track down Bowler Hat Guy in a showdown that ends with an unexpected twist of fate.",Walt Disney Studios Motion Pictures,"$97,822,171.00","$71,510,863.00","$169,333,034.00",PG
735,Yes Man (2008),2008,"A man challenges himself to say ""yes"" to everything.",Warner Bros.,"$97,690,976.00","$125,550,661.00","$223,241,637.00",PG-13
736,Sausage Party (2016),2016,A sausage strives to discover the truth about his existence.,Sony Pictures Entertainment (SPE),"$97,685,686.00","$43,019,636.00","$140,705,322.00",R
737,Inspector Gadget (1999),1999,A security guard's dreams come true when he is selected to be transformed into a cybernetic police officer.,Walt Disney Studios Motion Pictures,"$97,403,112.00","$37,000,000.00","$134,403,112.00",PG
738,Public Enemies (2009),2009,"The Feds try to take down notorious American gangsters John Dillinger, Baby Face Nelson and Pretty Boy Floyd during a booming crime wave in the 1930s.",Universal Pictures,"$97,104,620.00","$117,000,000.00","$214,104,620.00",R
739,The Social Network (2010),2010,"As Harvard student Mark Zuckerberg creates the social networking site that would become known as Facebook, he is sued by the twins who claimed he stole their idea, and by the co-founder who was later squeezed out of the business.",Sony Pictures Entertainment (SPE),"$96,962,694.00","$127,957,681.00","$224,920,375.00",PG-13
740,Schindler's List (1993),1993,"In German-occupied Poland during World War II, industrialist Oskar Schindler gradually becomes concerned for his Jewish workforce after witnessing their persecution by the Nazis.",Universal Pictures,"$96,898,818.00","$225,262,427.00","$322,161,245.00",R
741,Downton Abbey (2019),2019,"The continuing story of the Crawley family, wealthy owners of a large estate in the English countryside in the early twentieth century.",Focus Features,"$96,854,135.00","$96,941,361.00","$237,860,050.00",PG
742,The Others (2001),2001,A woman who lives in her darkened old family house with her two photosensitive children becomes convinced that the home is haunted.,Miramax,"$96,522,687.00","$113,424,350.00","$209,947,037.00",PG-13
743,Legally Blonde (2001),2001,"Elle Woods, a fashionable sorority queen, is dumped by her boyfriend. She decides to follow him to law school. While she is there, she figures out that there is more to her than just looks.",Metro-Goldwyn-Mayer (MGM),"$96,520,674.00","$45,254,005.00","$141,774,679.00",PG-13
