No.,Title,Release Year,Movie Info,Distributor,Domestic Sales (in $),International Sales (in $),World Sales (in $),License
364,La La Land (2016),2016,"While navigating their careers in Los Angeles, a pianist and an actress fall in love while attempting to reconcile their aspirations for the future.",Lionsgate,"$151,101,803.00","$297,805,062.00","$448,906,865.00",PG-13
365,Divergent (2014),2014,"In a world divided by factions based on virtues, Tris learns she's Divergent and won't fit in. When she discovers a plot to destroy Divergents, Tris and the mysterious Four must find out what makes Divergents dangerous before it's too late.",Lionsgate,"$150,947,895.00","$137,937,923.00","$288,885,818.00",PG-13
366,We're the Millers (2013),2013,A veteran pot dealer creates a fake family as part of his plan to move a huge shipment of weed into the U.S. from Mexico.,Warner Bros.,"$150,394,119.00","$119,600,000.00","$269,994,119.00",R
367,Terminator 3: Rise of the Machines (2003),2003,A machine from a post-apocalyptic future travels back in time to protect a man and a woman from an advanced robotic assassin to ensure they both survive a nuclear attack.,Warner Bros.,"$150,371,112.00","$283,000,000.00","$433,371,112.00",R
368,Daddy's Home (2015),2015,"Brad Whitaker is a radio host trying to get his stepchildren to love him and call him Dad. But his plans turn upside down when their biological father, Dusty Mayron, returns.",Paramount Pictures,"$150,357,137.00","$92,429,000.00","$242,786,137.00",PG
369,G.I. Joe: The Rise of Cobra (2009),2009,"An elite military unit comprised of special operatives known as G.I. Joe, operating out of The Pit, takes on an evil organization led by a notorious arms dealer.",Paramount Pictures,"$150,201,498.00","$152,267,519.00","$302,469,017.00",PG-13
370,Neighbors (2014),2014,"After they are forced to live next to a fraternity house, a couple with a newborn baby do whatever they can to take them down.",Universal Pictures,"$150,157,400.00","$120,507,734.00","$270,665,134.00",R
371,American Hustle (2013),2013,"A con man, Irving Rosenfeld, along with his seductive partner Sydney Prosser, is forced to work for a wild F.B.I. Agent, Richie DiMaso, who pushes them into a world of Jersey powerbrokers and the Mafia.",Sony Pictures Entertainment (SPE),"$150,117,807.00","$101,054,000.00","$251,171,807.00",R
372,Puss in Boots (2011),2011,"An outlaw cat, his childhood egg-friend and a seductive thief kitty set out in search for the eggs of the fabled Golden Goose to clear his name, restore his lost honor and regain the trust of his mother and town.",DreamWorks,"$149,260,504.00","$405,726,973.00","$554,987,477.00",PG
373,Sonic the Hedgehog (2020),2020,"After discovering a small, blue, fast hedgehog, a small-town police officer must help him defeat an evil genius who wants to do experiments on him.",Paramount Pictures,"$148,974,665.00","$170,741,018.00","$319,715,683.00",PG
374,Les Misérables (2012),2012,"In 19th-century France, Jean Valjean, who for decades has been hunted by the ruthless policeman Javert after breaking parole, agrees to care for a factory worker's daughter. The decision changes their lives forever.",Universal Pictures,"$148,809,770.00","$293,489,539.00","$442,299,309.00",PG-13
375,Knocked Up (2007),2007,"For fun-loving party animal Ben Stone, the last thing he ever expected was for his one-night stand to show up on his doorstep eight weeks later to tell him she's pregnant with his child.",Universal Pictures,"$148,768,917.00","$71,153,500.00","$219,922,417.00",R
376,As Good as It Gets (1997),1997,"A single mother and waitress, a misanthropic author, and a gay artist form an unlikely friendship after the artist is assaulted in a robbery.",Sony Pictures Entertainment (SPE),"$148,478,011.00","$165,700,000.00","$314,178,011.00",PG-13
377,Little Fockers (2010),2010,"Family-patriarch Jack Byrnes wants to appoint a successor. Does his son-in-law, the male nurse Greg Focker, have what it takes?",Universal Pictures,"$148,438,600.00","$162,211,985.00","$310,650,585.00",PG-13
378,Megamind (2010),2010,"Evil genius Megamind finally defeats his do-gooder nemesis, Metro Man, but is left without a purpose in a superhero-free world.",DreamWorks,"$148,415,853.00","$173,469,912.00","$321,885,765.00",PG
379,Hotel Transylvania (2012),2012,"Dracula, who operates a high-end resort away from the human world, goes into overprotective mode when a boy discovers the resort and falls for the count's teenaged daughter.",Sony Pictures Entertainment (SPE),"$148,313,048.00","$210,062,555.00","$358,375,603.00",PG
380,Talladega Nights: The Ballad of Ricky Bobby (2006),2006,"Number one NASCAR driver Ricky Bobby stays atop the heap thanks to a pact with his best friend and teammate, Cal Naughton, Jr. But when a French Formula One driver, makes his way up the ladder, Ricky Bobby's talent and devotion are put to the test.",Sony Pictures Entertainment (SPE),"$148,213,377.00","$15,148,718.00","$163,362,095.00",PG-13
381,Gran Torino (2008),2008,"Disgruntled Korean War veteran Walt Kowalski sets out to reform his neighbor, Thao Lor, a Hmong teenager who tried to steal Kowalski's prized possession: a 1972 Gran Torino.",Warner Bros.,"$148,095,302.00","$121,862,926.00","$269,958,228.00",R
382,Lethal Weapon 2 (1989),1989,Riggs and Murtaugh are on the trail of South African diplomats who are using their immunity to engage in criminal activities.,Warner Bros.,"$147,253,986.00","$80,600,000.00","$227,853,986.00",PG-13
383,War for the Planet of the Apes (2017),2017,"After the apes suffer unimaginable losses, Caesar wrestles with his darker instincts and begins his own mythic quest to avenge his kind.",Twentieth Century Fox,"$146,880,162.00","$343,839,601.00","$490,719,763.00",PG-13
384,X-Men: First Class (2011),2011,"In the 1960s, superpowered humans Charles Xavier and Erik Lensherr work together to find others like them, but Erik's vengeful pursuit of an ambitious mutant who ruined his life causes a schism to divide them.",Twentieth Century Fox,"$146,408,305.00","$206,208,385.00","$352,616,690.00",PG-13
385,Paul Blart: Mall Cop (2009),2009,"When a shopping mall is taken over by a gang of organized crooks, it's up to a mild-mannered security guard to save the day.",Sony Pictures Entertainment (SPE),"$146,336,178.00","$37,012,251.00","$183,348,429.00",PG
386,True Lies (1994),1994,"A fearless, globe-trotting, terrorist-battling secret agent has his life turned upside down when he discovers his wife might be having an affair with a used-car salesman while terrorists smuggle nuclear war heads into the United States.",Twentieth Century Fox,"$146,282,411.00","$232,600,000.00","$378,882,411.00",R
387,Lilo & Stitch (2002),2002,"A young and parentless girl adopts a 'dog' from the local pound, completely unaware that it's supposedly a dangerous scientific experiment that's taken refuge on Earth and is now hiding from its creator and those who see it as a menace.",Walt Disney Studios Motion Pictures,"$145,794,338.00","$127,349,813.00","$273,144,151.00",PG
388,The Santa Clause (1994),1994,"When a man inadvertently makes Santa fall off of his roof on Christmas Eve, he finds himself magically recruited to take his place.",Walt Disney Studios Motion Pictures,"$145,539,357.00","$45,000,000.00","$190,539,357.00",PG
389,The Meg (2018),2018,A group of scientists exploring the Marianas Trench encounter the largest marine predator that has ever existed - the Megalodon.,Warner Bros.,"$145,443,742.00","$384,994,536.00","$530,438,278.00",PG-13
390,American Pie 2 (2001),2001,"Jim and his friends are now in college, and they decide to meet up at the beach house for some fun.",Universal Pictures,"$145,103,595.00","$142,450,000.00","$287,553,595.00",R
391,Taken (2008),2008,"A retired CIA agent travels across Europe and relies on his old skills to save his estranged daughter, who has been kidnapped while on a trip to Paris.",Twentieth Century Fox,"$145,000,989.00","$81,836,771.00","$226,837,760.00",PG-13
392,The Great Gatsby (2013),2013,"A writer and wall street trader, Nick, finds himself drawn to the past and lifestyle of his millionaire neighbor, Jay Gatsby.",Warner Bros.,"$144,840,419.00","$208,801,855.00","$353,642,274.00",PG-13
393,"I, Robot (2004)",2004,"In 2035, a technophobic cop investigates a crime that may have been perpetrated by a robot, which leads to a larger threat to humanity.",Twentieth Century Fox,"$144,801,023.00","$208,332,875.00","$353,133,898.00",PG-13
394,Lethal Weapon 3 (1992),1992,Martin Riggs and Roger Murtaugh pursue a former LAPD officer who uses his knowledge of police procedure and policies to steal and sell confiscated guns and ammunition to local street gangs.,Warner Bros.,"$144,731,527.00","$177,000,000.00","$321,731,527.00",R
395,The Fast and the Furious (2001),2001,Los Angeles police officer Brian O'Conner must decide where his loyalty really lies when he becomes enamored with the street racing world he has been sent undercover to destroy.,Universal Pictures,"$144,533,925.00","$62,771,584.00","$207,305,509.00",PG-13
396,Mamma Mia! (2008),2008,The story of a bride-to-be trying to find her real father told using hit songs by the popular 1970s group ABBA.,Universal Pictures,"$144,169,664.00","$467,088,155.00","$611,257,819.00",PG-13
397,Doctor Dolittle (1998),1998,A doctor discovers that he can communicate with animals.,Twentieth Century Fox,"$144,156,605.00","$150,300,000.00","$294,456,605.00",PG
398,Pokémon Detective Pikachu (2019),2019,"In a world where people collect Pokémon to do battle, a boy comes across an intelligent talking Pikachu who seeks to be a detective.",Warner Bros.,"$144,105,346.00","$289,409,488.00","$433,514,834.00",PG
399,Rio (2011),2011,"When Blu, a domesticated macaw from small-town Minnesota, meets the fiercely independent Jewel, he takes off on an adventure to Rio de Janeiro with the bird of his dreams.",Twentieth Century Fox,"$143,619,809.00","$340,246,709.00","$483,866,518.00",PG
400,Kung Fu Panda 3 (2016),2016,"Continuing his ""legendary adventures of awesomeness"", Po must face two hugely epic, but different threats: one supernatural and the other a little closer to home.",Twentieth Century Fox,"$143,528,619.00","$377,642,206.00","$521,170,825.00",PG
401,Juno (2007),2007,"Faced with an unplanned pregnancy, an offbeat young woman makes an unusual decision regarding the unborn child.",Fox Searchlight Pictures,"$143,495,265.00","$88,877,416.00","$232,372,681.00",PG-13
402,Marley & Me (2008),2008,"A family learns important life lessons from their adorable, but naughty and neurotic dog.",Twentieth Century Fox,"$143,153,751.00","$112,589,342.00","$255,743,093.00",PG
403,The Smurfs (2011),2011,"When the evil wizard Gargamel chases the tiny blue Smurfs out of their village, they tumble from their magical world into New York City.",Sony Pictures Entertainment (SPE),"$142,614,158.00","$421,135,165.00","$563,749,323.00",PG
404,Once Upon a Time... In Hollywood (2019),2019,A faded television actor and his stunt double strive to achieve fame and success in the final years of Hollywood's Golden Age in 1969 Los Angeles.,Sony Pictures Entertainment (SPE),"$142,502,728.00","$232,063,026.00","$374,565,754.00",R
405,xXx (2002),2002,"An extreme sports athlete, Xander Cage, is recruited by the government on a special mission.",Revolution Studios,"$142,109,382.00","$135,339,000.00","$277,448,382.00",PG-13
406,The Chronicles of Narnia: Prince Caspian (2008),2008,"The Pevensie siblings return to Narnia, where they are enlisted to once again help ward off an evil king and restore the rightful heir to the land's throne, Prince Caspian.",Walt Disney Studios Motion Pictures,"$141,621,490.00","$278,044,078.00","$419,665,568.00",PG
407,Pocahontas (1995),1995,An English soldier and the daughter of an Algonquin chief share a romance when English colonists invade seventeenth century Virginia.,Walt Disney Studios Motion Pictures,"$141,579,773.00","$204,500,000.00","$346,079,773.00",PG
408,A Few Good Men (1992),1992,Military lawyer Lieutenant Daniel Kaffee defends Marines accused of murder. They contend they were acting under orders.,Columbia Pictures,"$141,340,178.00","$101,900,000.00","$243,240,178.00",R
409,Slumdog Millionaire (2008),2008,"A Mumbai teenager reflects on his life after being accused of cheating on the Indian version of ""Who Wants to be a Millionaire?"".",Fox Searchlight Pictures,"$141,319,928.00","$237,090,614.00","$378,410,542.00",R
410,Rush Hour (1998),1998,"A loyal and dedicated Hong Kong Inspector teams up with a reckless and loudmouthed L.A.P.D. detective to rescue the Chinese Consul's kidnapped daughter, while trying to arrest a dangerous crime lord along the way.",New Line Cinema,"$141,186,864.00","$103,534,200.00","$244,721,064.00",PG-13
411,The Blair Witch Project (1999),1999,"Three film students vanish after traveling into a Maryland forest to film a documentary on the local Blair Witch legend, leaving only their footage behind.",Artisan Entertainment,"$140,539,099.00","$108,100,000.00","$248,639,099.00",R
412,Deep Impact (1998),1998,"A comet is discovered to be on a collision course with Earth. As doomsday nears, the human race prepares for the worst.",Paramount Pictures,"$140,464,664.00","$209,000,000.00","$349,464,664.00",PG
413,Shazam! (2019),2019,A newly fostered young boy in search of his mother instead finds unexpected super powers and soon gains a powerful enemy.,Warner Bros.,"$140,371,656.00","$225,600,000.00","$365,971,656.00",PG-13
414,Ocean's Eight (2018),2018,Debbie Ocean gathers an all-female crew to attempt an impossible heist at New York City's yearly Met Gala.,Warner Bros.,"$140,218,711.00","$157,500,000.00","$297,718,711.00",PG-13
415,Rush Hour 3 (2007),2007,"After an attempted assassination on Ambassador Han, Lee and Carter head to Paris to protect a French woman with knowledge of the Triads' secret leaders.",New Line Cinema,"$140,125,968.00","$117,971,154.00","$258,097,122.00",PG-13
416,Stuart Little (1999),1999,"The Little family adopt a charming young mouse named Stuart, but the family cat wants rid of him.",Sony Pictures Entertainment (SPE),"$140,035,367.00","$160,100,000.00","$300,135,367.00",PG
417,Taken 2 (2012),2012,"In Istanbul, retired CIA operative Bryan Mills and his wife are taken hostage by the father of a kidnapper Mills killed while rescuing his daughter.",Twentieth Century Fox,"$139,854,287.00","$236,298,168.00","$376,152,455.00",PG-13
418,Sister Act (1992),1992,"When a nightclub singer is forced to take refuge from the mob in a convent, she ends up turning the convent choir into a soulful chorus complete with a Motown repertoire, until the sudden celebrity of the choir jeopardizes her identity.",Walt Disney Studios Motion Pictures,"$139,605,150.00","$92,000,000.00","$231,605,150.00",PG
419,The Matrix Revolutions (2003),2003,The human city of Zion defends itself against the massive invasion of the machines as Neo fights to end the war at another front while also opposing the rogue Agent Smith.,Warner Bros.,"$139,313,948.00","$288,030,377.00","$427,344,325.00",R
420,The Santa Clause 2 (2002),2002,"Scott Calvin has been a humble Santa Claus for nearly ten years, but it might come to an end if he doesn't find a Mrs. Claus.",Walt Disney Studios Motion Pictures,"$139,236,327.00","$33,618,738.00","$172,855,065.00",PG
421,The King's Speech (2010),2010,"The story of King George VI, his impromptu ascension to the throne of the British Empire in 1936, and the speech therapist who helped the unsure monarch overcome his stammer.",The Weinstein Company,"$138,797,449.00","$288,576,868.00","$427,374,317.00",R
422,Cheaper by the Dozen (2003),2003,"With his wife doing a book tour, a father of twelve must handle a new job and his unstable brood.",Twentieth Century Fox,"$138,614,544.00","$51,924,086.00","$190,538,630.00",PG
423,Bad Boys II (2003),2003,Two loose-cannon narcotics cops investigate the flow of Ecstasy into Florida from a Cuban drug cartel.,Sony Pictures Entertainment (SPE),"$138,608,444.00","$134,731,112.00","$273,339,556.00",R
424,Platoon (1986),1986,"Chris Taylor, a neophyte recruit in Vietnam, finds himself caught in a battle of wills between two sergeants, one good and the other evil. A shrewd examination of the brutality of war and the duality of man in conflict.",Orion Pictures,"$138,530,565.00","$15,067.00","$138,545,632.00",PG
425,21 Jump Street (2012),2012,A pair of underachieving cops are sent back to a local high school to blend in and bring down a synthetic drug ring.,Sony Pictures Entertainment (SPE),"$138,447,667.00","$63,137,661.00","$201,585,328.00",R
426,Good Will Hunting (1997),1997,"Will Hunting, a janitor at M.I.T., has a gift for mathematics, but needs help from a psychologist to find direction in his life.",Miramax,"$138,433,435.00","$87,500,000.00","$225,933,435.00",PG
427,Split (2016),2016,Three girls are kidnapped by a man with a diagnosed 23 distinct personalities. They must try to escape before the apparent emergence of a frightful new 24th.,Universal Pictures,"$138,291,365.00","$140,163,052.00","$278,454,417.00",PG-13
428,A Christmas Carol (2009),2009,"An animated retelling of Charles Dickens' classic novel about a Victorian-era miser taken on a journey of self-redemption, courtesy of several mysterious Christmas apparitions.",Walt Disney Studios Motion Pictures,"$137,855,863.00","$187,430,783.00","$325,286,646.00",PG
429,Dinosaur (2000),2000,An orphaned dinosaur raised by lemurs joins an arduous trek to a sanctuary after a meteorite shower destroys his family home.,Walt Disney Studios Motion Pictures,"$137,748,063.00","$212,074,702.00","$349,822,765.00",PG
430,Ready Player One (2018),2018,"When the creator of a virtual reality called the OASIS dies, he makes a posthumous challenge to all OASIS users to find his Easter Egg, which will give the finder his fortune and control of his world.",Warner Bros.,"$137,690,172.00","$445,203,499.00","$582,893,671.00",PG-13
431,The Conjuring (2013),2013,Paranormal investigators Ed and Lorraine Warren work to help a family terrorized by a dark presence in their farmhouse.,Warner Bros.,"$137,400,141.00","$182,890,848.00","$320,290,989.00",R
432,Click (2006),2006,A workaholic architect finds a universal remote that allows him to fast-forward and rewind to different parts of his life. Complications arise when the remote starts to overrule his choices.,Revolution Studios,"$137,355,633.00","$103,329,693.00","$240,685,326.00",PG-13
433,The Green Mile (1999),1999,"The lives of guards on Death Row are affected by one of their charges: a black man accused of child murder and rape, yet who has a mysterious gift.",Warner Bros.,"$136,801,374.00","$150,000,000.00","$286,801,374.00",R
434,Ransom (1996),1996,"Multi-millionaire Tom Mullen's son is kidnapped, but after initially agreeing to pay the ransom Mullen then decides to use the ransom money as a bounty.",Walt Disney Studios Motion Pictures,"$136,492,681.00","$173,000,000.00","$309,492,681.00",PG
435,Godzilla (1998),1998,French nuclear tests irradiate an iguana into a giant monster that heads off to New York City. The American military must chase the monster across the city to stop it before it reproduces.,Sony Pictures Entertainment (SPE),"$136,314,294.00","$242,700,000.00","$379,014,294.00",PG-13
436,Argo (2012),2012,"Acting under the cover of a Hollywood producer scouting a location for a science fiction film, a CIA agent launches a dangerous operation to rescue six Americans in Tehran during the U.S. hostage crisis in Iran in 1979.",Warner Bros.,"$136,025,503.00","$96,300,000.00","$232,325,503.00",R
437,Anger Management (2003),2003,"Dave Buznik is a businessman who is wrongly sentenced to an anger management program, where he meets an aggressive instructor.",Revolution Studios,"$135,645,823.00","$60,100,000.00","$195,745,823.00",PG-13
438,Chicken Little (2005),2005,"After ruining his reputation with the town, a courageous chicken must come to the rescue of his fellow citizens when aliens start an invasion.",Walt Disney Studios Motion Pictures,"$135,386,665.00","$179,046,172.00","$314,432,837.00",PG
439,Teenage Mutant Ninja Turtles (1990),1990,Four teenage mutant ninja turtles emerge from the shadows to protect New York City from a gang of criminal ninjas.,New Line Cinema,"$135,265,915.00","$66,700,000.00","$201,965,915.00",PG
440,Patch Adams (1998),1998,"The true story of a heroic man, Hunter ""Patch"" Adams, determined to become a medical doctor because he enjoys helping people. He ventured where no doctor had ventured before, using humour and pathos.",Universal Pictures,"$135,026,902.00","$67,266,000.00","$202,292,902.00",PG-13
441,The Godfather (1972),1972,"The Godfather follows Vito Corleone, Don of the Corleone family, as he passes the mantel to his unwilling son, Michael.",Paramount Pictures,"$134,966,411.00","$111,154,575.00","$246,120,986.00",PG-13
442,Ride Along (2014),2014,"Security guard Ben must prove himself to his girlfriend's brother, top police officer James. He rides along James on a 24-hour patrol of Atlanta.",Universal Pictures,"$134,938,200.00","$19,530,702.00","$154,468,902.00",PG-13
443,The Incredible Hulk (2008),2008,"Bruce Banner, a scientist on the run from the U.S. Government, must find a cure for the monster he turns into whenever he loses his temper.",Universal Pictures,"$134,806,913.00","$129,964,083.00","$264,770,996.00",PG-13
444,Live Free or Die Hard (2007),2007,John McClane and a young hacker join forces to take down master cyber-terrorist Thomas Gabriel in Washington D.C.,Twentieth Century Fox,"$134,529,403.00","$253,626,608.00","$388,156,011.00",PG-13
445,Wanted (2008),2008,"A frustrated office worker discovers that he is the son of a professional assassin, and that he shares his father's superhuman killing abilities.",Universal Pictures,"$134,508,551.00","$207,954,512.00","$342,463,063.00",R
446,Identity Thief (2013),2013,Mild mannered businessman Sandy Patterson travels from Denver to Florida to confront the deceptively harmless looking woman who has been living it up after stealing Sandy's identity.,Universal Pictures,"$134,506,920.00","$39,458,090.00","$173,965,010.00",R
447,Superman (1978),1978,"An alien orphan is sent from his dying planet to Earth, where he grows up to become his adoptive home's first and greatest superhero.",Warner Bros.,"$134,451,603.00","$166,000,000.00","$300,451,603.00",PG
448,The Rock (1996),1996,"A mild-mannered chemist and an ex-con must lead the counterstrike when a rogue group of military men, led by a renegade general, threaten a nerve gas attack from Alcatraz against San Francisco.",Walt Disney Studios Motion Pictures,"$134,069,511.00","$200,993,110.00","$335,062,621.00",R
449,Mission: Impossible III (2006),2006,IMF agent Ethan Hunt comes into conflict with a dangerous and sadistic arms dealer who threatens his life and his fiancée in response.,Paramount Pictures,"$134,029,801.00","$264,449,696.00","$398,479,497.00",PG-13
450,Grown Ups 2 (2013),2013,"After moving his family back to his hometown to be with his friends and their kids, Lenny finds out that between old bullies, new bullies, schizo bus drivers, drunk cops on skis, and four hundred costumed party crashers sometimes crazy follows you.",Sony Pictures Entertainment (SPE),"$133,668,525.00","$113,315,753.00","$246,984,278.00",PG-13
451,Troy (2004),2004,"An adaptation of Homer's great epic, the film follows the assault on Troy by the united Greek forces and chronicles the fates of the men involved.",Warner Bros.,"$133,378,256.00","$364,031,596.00","$497,409,852.00",R
452,Angels & Demons (2009),2009,Harvard symbologist Robert Langdon works with a nuclear physicist to solve a murder and prevent a terrorist act against the Vatican during one of the significant events within the church.,Sony Pictures Entertainment (SPE),"$133,375,846.00","$352,554,970.00","$485,930,816.00",PG-13
453,Alvin and the Chipmunks: Chipwrecked (2011),2011,"Playing around while aboard a cruise ship, the Chipmunks and Chipettes accidentally go overboard and end up marooned in a tropical paradise. They discover their new turf is not as deserted as it seems.",Twentieth Century Fox,"$133,110,742.00","$209,584,693.00","$342,695,435.00",PG
454,Bringing Down the House (2003),2003,"When a lonely guy meets a woman on the internet who happens to be in prison, she breaks out to get him to prove her innocence, and proceeds to wreak havoc on his middle-class life.",Walt Disney Studios Motion Pictures,"$132,716,677.00","$32,013,002.00","$164,729,679.00",PG-13
455,The Wolverine (2013),2013,"Wolverine comes to Japan to meet an old friend whose life he saved years ago, and gets embroiled in a conspiracy involving yakuza and mutants.",Twentieth Century Fox,"$132,556,852.00","$282,271,394.00","$414,828,246.00",PG-13
456,Wonder (2017),2017,"Based on the New York Times bestseller, this movie tells the incredibly inspiring and heartwarming story of August Pullman, a boy with facial differences who enters the fifth grade, attending a mainstream elementary school for the first time.",Lionsgate,"$132,422,809.00","$173,786,480.00","$306,209,289.00",PG-13
457,The Departed (2006),2006,An undercover cop and a mole in the police attempt to identify each other while infiltrating an Irish gang in South Boston.,Warner Bros.,"$132,384,315.00","$159,081,058.00","$291,465,373.00",R
458,Hulk (2003),2003,"Bruce Banner, a genetics researcher with a tragic past, suffers an accident that causes him to transform into a raging green monster when he gets angry.",Universal Pictures,"$132,177,234.00","$113,107,931.00","$245,285,165.00",PG-13
