No.,Title,Release Year,Movie Info,Distributor,Domestic Sales (in $),International Sales (in $),World Sales (in $),License
0,Star Wars: Episode VII - The Force Awakens (2015),2015,"As a new threat to the galaxy rises, Rey, a desert scavenger, and Finn, an ex-stormtrooper, must join Han Solo and Chewbacca to search for the one hope of restoring peace.",Walt Disney Studios Motion Pictures,"$936,662,225.00","$1,132,859,475.00","$2,069,521,700.00",PG-13
1,Avengers: Endgame (2019),2019,"After the devastating events of Avengers: Infinity War, the universe is in ruins. With the help of remaining allies, the Avengers assemble once more in order to reverse Thanos' actions and restore balance to the universe.",Walt Disney Studios Motion Pictures,"$858,373,000.00","$1,939,128,328.00","$2,797,501,328.00",PG-13
2,Avatar (2009),2009,A paraplegic Marine dispatched to the moon Pandora on a unique mission becomes torn between following his orders and protecting the world he feels is his home.,Twentieth Century Fox,"$760,507,625.00","$2,086,738,578.00","$2,847,246,203.00",PG-13
3,Black Panther (2018),2018,"T'Challa, heir to the hidden but advanced kingdom of Wakanda, must step forward to lead his people into a new future and must confront a challenger from his country's past.",Walt Disney Studios Motion Pictures,"$700,426,566.00","$647,171,407.00","$1,347,597,973.00",PG-13
4,Avengers: Infinity War (2018),2018,The Avengers and their allies must be willing to sacrifice all in an attempt to defeat the powerful Thanos before his blitz of devastation and ruin puts an end to the universe.,Walt Disney Studios Motion Pictures,"$678,815,482.00","$1,369,544,272.00","$2,048,359,754.00",PG-13
5,Spider-Man: No Way Home (2021),2021,"With Spider-Man's identity now revealed, Peter asks Doctor Strange for help. When a spell goes wrong, dangerous foes from other worlds start to appear, forcing Peter to discover what it truly means to be Spider-Man.",Sony Pictures Entertainment (SPE),"$675,813,257.00","$868,642,706.00","$1,544,455,963.00",PG-13
6,Titanic (1997),1997,"A seventeen-year-old aristocrat falls in love with a kind but poor artist aboard the luxurious, ill-fated R.M.S. Titanic.",Paramount Pictures,"$659,363,944.00","$1,542,283,320.00","$2,201,647,264.00",PG-13
7,Jurassic World (2015),2015,"A new theme park, built on the original site of Jurassic Park, creates a genetically modified hybrid dinosaur, the Indominus Rex, which escapes containment and goes on a killing spree.",Universal Pictures,"$652,385,625.00","$1,018,130,819.00","$1,670,516,444.00",PG-13
8,The Avengers (2012),2012,Earth's mightiest heroes must come together and learn to fight as a team if they are going to stop the mischievous Loki and his alien army from enslaving humanity.,Walt Disney Studios Motion Pictures,"$623,357,910.00","$895,457,605.00","$1,518,815,515.00",PG-13
9,Star Wars: Episode VIII - The Last Jedi (2017),2017,"The Star Wars saga continues as new heroes and galactic legends go on an epic adventure, unlocking mysteries of the Force and shocking revelations of the past.",Walt Disney Studios Motion Pictures,"$620,181,382.00","$712,517,448.00","$1,332,698,830.00",PG-13
10,Incredibles 2 (2018),2018,The Incredibles family takes on a new mission which involves a change in family roles: Bob Parr (Mr. Incredible) must manage the house while his wife Helen (Elastigirl) goes out to save the world.,Walt Disney Studios Motion Pictures,"$608,581,744.00","$634,507,500.00","$1,243,089,244.00",PG
11,The Lion King (2019),2019,"After the murder of his father, a young lion prince flees his kingdom only to learn the true meaning of responsibility and bravery.",Walt Disney Studios Motion Pictures,"$543,638,043.00","$1,119,261,396.00","$1,662,899,439.00",PG
12,The Dark Knight (2008),2008,"When the menace known as the Joker wreaks havoc and chaos on the people of Gotham, Batman must accept one of the greatest psychological and physical tests of his ability to fight injustice.",Warner Bros.,"$534,858,444.00","$471,115,201.00","$1,005,973,645.00",PG-13
13,Rogue One: A Star Wars Story (2016),2016,"In a time of conflict, a group of unlikely heroes band together on a mission to steal the plans to the Death Star, the Empire's ultimate weapon of destruction.",Walt Disney Studios Motion Pictures,"$532,177,324.00","$523,880,396.00","$1,056,057,720.00",PG-13
14,Star Wars: Episode IX - The Rise of Skywalker (2019),2019,"In the riveting conclusion of the landmark Skywalker saga, new legends will be born-and the final battle for freedom is yet to come.",Walt Disney Studios Motion Pictures,"$515,202,542.00","$558,946,737.00","$1,074,149,279.00",PG-13
15,Beauty and the Beast (2017),2017,"A selfish Prince is cursed to become a monster for the rest of his life, unless he learns to fall in love with a beautiful young woman he keeps prisoner.",Walt Disney Studios Motion Pictures,"$504,481,165.00","$769,095,055.00","$1,273,576,220.00",PG
16,Finding Dory (2016),2016,"Friendly but forgetful blue tang Dory begins a search for her long-lost parents, and everyone learns a few things about the real meaning of family along the way.",Walt Disney Studios Motion Pictures,"$486,295,561.00","$542,275,381.00","$1,028,570,942.00",PG
17,Frozen II (2019),2019,"Anna, Elsa, Kristoff, Olaf and Sven leave Arendelle to travel to an ancient, autumn-bound forest of an enchanted land. They set out to find the origin of Elsa's powers in order to save their kingdom.",Walt Disney Studios Motion Pictures,"$477,373,578.00","$972,653,355.00","$1,450,026,933.00",PG
18,Star Wars: Episode I - The Phantom Menace (1999),1999,"Two Jedi escape a hostile blockade to find allies and come across a young boy who may bring balance to the Force, but the long dormant Sith resurface to claim their original glory.",Twentieth Century Fox,"$474,544,677.00","$552,538,030.00","$1,027,082,707.00",PG
19,Star Wars: Episode IV - A New Hope (1977),1977,"Luke Skywalker joins forces with a Jedi Knight, a cocky pilot, a Wookiee and two droids to save the galaxy from the Empire's world-destroying battle station, while also attempting to rescue Princess Leia from the mysterious Darth Vader.",Twentieth Century Fox,"$460,998,507.00","$195,751,992.00","$775,398,007.00",PG
20,Avengers: Age of Ultron (2015),2015,"When Tony Stark and Bruce Banner try to jump-start a dormant peacekeeping program called Ultron, things go horribly wrong and it's up to Earth's mightiest heroes to stop the villainous Ultron from enacting his terrible plan.",Walt Disney Studios Motion Pictures,"$459,005,868.00","$943,803,672.00","$1,402,809,540.00",PG-13
21,The Dark Knight Rises (2012),2012,"Eight years after the Joker's reign of anarchy, Batman, with the help of the enigmatic Catwoman, is forced from his exile to save Gotham City from the brutal guerrilla terrorist Bane.",Warner Bros.,"$448,139,099.00","$633,003,513.00","$1,081,142,612.00",PG-13
22,Shrek 2 (2004),2004,"Shrek and Fiona travel to the Kingdom of Far Far Away, where Fiona's parents are King and Queen, to celebrate their marriage. When they arrive, they find they are not as welcome as they thought they would be.",DreamWorks Distribution,"$441,226,247.00","$487,534,523.00","$928,760,770.00",PG
23,E.T. the Extra-Terrestrial (1982),1982,A troubled child summons the courage to help a friendly alien escape Earth and return to his home world.,Universal Pictures,"$435,110,554.00","$304,203,888.00","$792,910,554.00",PG
24,Toy Story 4 (2019),2019,"When a new toy called ""Forky"" joins Woody and the gang, a road trip alongside old and new friends reveals how big the world can be for a toy.",Walt Disney Studios Motion Pictures,"$434,038,008.00","$639,356,585.00","$1,073,394,593.00",PG
25,Captain Marvel (2019),2019,Carol Danvers becomes one of the universe's most powerful heroes when Earth is caught in the middle of a galactic war between two alien races.,Walt Disney Studios Motion Pictures,"$426,829,839.00","$701,633,133.00","$1,128,462,972.00",PG-13
26,The Hunger Games: Catching Fire (2013),2013,Katniss Everdeen and Peeta Mellark become targets of the Capitol after their victory in the 74th Hunger Games sparks a rebellion in the Districts of Panem.,Lionsgate,"$424,668,047.00","$440,343,699.00","$865,011,746.00",PG-13
27,Pirates of the Caribbean: Dead Man's Chest (2006),2006,"Jack Sparrow races to recover the heart of Davy Jones to avoid enslaving his soul to Jones' service, as other friends and foes seek the heart for their own agenda as well.",Walt Disney Studios Motion Pictures,"$423,315,812.00","$642,863,935.00","$1,066,179,747.00",PG-13
28,The Lion King (1994),1994,"Lion prince Simba and his father are targeted by his bitter uncle, who wants to ascend the throne himself.",Walt Disney Studios Motion Pictures,"$422,783,777.00","$640,828,028.00","$1,063,611,805.00",PG
29,Jurassic World: Fallen Kingdom (2018),2018,"When the island's dormant volcano begins roaring to life, Owen and Claire mount a campaign to rescue the remaining dinosaurs from this extinction-level event.",Universal Pictures,"$417,719,760.00","$892,746,536.00","$1,310,466,296.00",PG-13
30,Toy Story 3 (2010),2010,"The toys are mistakenly delivered to a day-care center instead of the attic right before Andy leaves for college, and it's up to Woody to convince the other toys that they weren't abandoned and to return home.",Walt Disney Studios Motion Pictures,"$415,004,880.00","$651,965,931.00","$1,066,970,811.00",PG
31,Wonder Woman (2017),2017,"When a pilot crashes and tells of conflict in the outside world, Diana, an Amazonian warrior in training, leaves home to fight a war, discovering her full powers and true destiny.",Warner Bros.,"$412,815,408.00","$410,009,114.00","$822,824,522.00",PG-13
32,Iron Man 3 (2013),2013,"When Tony Stark's world is torn apart by a formidable terrorist called the Mandarin, he starts an odyssey of rebuilding and retribution.",Walt Disney Studios Motion Pictures,"$409,013,994.00","$805,797,258.00","$1,214,811,252.00",PG-13
33,Captain America: Civil War (2016),2016,Political involvement in the Avengers' affairs causes a rift between Captain America and Iron Man.,Walt Disney Studios Motion Pictures,"$408,084,349.00","$745,253,147.00","$1,153,337,496.00",PG-13
34,The Hunger Games (2012),2012,Katniss Everdeen voluntarily takes her younger sister's place in the Hunger Games: a televised competition in which two teenagers from each of the twelve Districts of Panem are chosen at random to fight to the death.,Lionsgate,"$408,010,692.00","$286,384,032.00","$694,394,724.00",PG-13
35,Spider-Man (2002),2002,"When bitten by a genetically modified spider, a nerdy, shy, and awkward high school student gains spider-like abilities that he eventually must use to fight evil as a superhero after tragedy befalls his family.",Sony Pictures Entertainment (SPE),"$407,022,860.00","$418,002,176.00","$825,025,036.00",PG-13
36,Jumanji: Welcome to the Jungle (2017),2017,"Four teenagers are sucked into a magical video game, and the only way they can escape is to work together to finish the game.",Sony Pictures Entertainment (SPE),"$404,540,171.00","$558,002,774.00","$962,542,945.00",PG-13
37,Jurassic Park (1993),1993,A pragmatic paleontologist touring an almost complete theme park on an island in Central America is tasked with protecting a couple of kids after a power failure causes the park's cloned dinosaurs to run loose.,Universal Pictures,"$404,214,720.00","$629,713,583.00","$1,033,928,303.00",PG-13
38,Transformers: Revenge of the Fallen (2009),2009,"Sam Witwicky leaves the Autobots behind for a normal life. But when his mind is filled with cryptic symbols, the Decepticons target him and he is dragged back into the Transformers' war.",DreamWorks,"$402,111,870.00","$434,191,823.00","$836,303,693.00",PG-13
39,Frozen (2013),2013,"When the newly crowned Queen Elsa accidentally uses her power to turn things into ice to curse her home in infinite winter, her sister Anna teams up with a mountain man, his playful reindeer, and a snowman to change the weather condition.",Walt Disney Studios Motion Pictures,"$400,953,009.00","$880,555,091.00","$1,281,508,100.00",PG
40,Spider-Man: Far from Home (2019),2019,"Following the events of Avengers: Endgame, Spider-Man must step up to take on new threats in a world that has changed forever.",Sony Pictures Entertainment (SPE),"$390,532,085.00","$741,395,911.00","$1,131,927,996.00",PG-13
41,Guardians of the Galaxy Vol. 2 (2017),2017,"The Guardians struggle to keep together as a team while dealing with their personal family issues, notably Star-Lord's encounter with his father the ambitious celestial being Ego.",Walt Disney Studios Motion Pictures,"$389,813,101.00","$473,942,950.00","$863,756,051.00",PG-13
42,Harry Potter and the Deathly Hallows: Part 2 (2011),2011,"Harry, Ron, and Hermione search for Voldemort's remaining Horcruxes in their effort to destroy the Dark Lord as the final battle rages on at Hogwarts.",Warner Bros.,"$381,409,310.00","$960,912,354.00","$1,342,321,665.00",PG
43,Finding Nemo (2003),2003,"After his son is captured in the Great Barrier Reef and taken to Sydney, a timid clownfish sets out on a journey to bring him home.",Walt Disney Studios Motion Pictures,"$380,843,261.00","$559,509,384.00","$940,352,645.00",PG
44,Star Wars: Episode III - Revenge of the Sith (2005),2005,"Three years into the Clone Wars, the Jedi rescue Palpatine from Count Dooku. As Obi-Wan pursues a new threat, Anakin acts as a double agent between the Jedi Council and Palpatine and is lured into a sinister plan to rule the galaxy.",Twentieth Century Fox,"$380,270,577.00","$488,119,983.00","$868,390,560.00",PG-13
45,The Lord of the Rings: The Return of the King (2003),2003,Gandalf and Aragorn lead the World of Men against Sauron's army to draw his gaze from Frodo and Sam as they approach Mount Doom with the One Ring.,New Line Cinema,"$377,845,905.00","$768,185,007.00","$1,146,030,912.00",PG-13
46,Spider-Man 2 (2004),2004,Peter Parker is beset with troubles in his failing personal life as he battles a brilliant scientist named Doctor Otto Octavius.,Sony Pictures Entertainment (SPE),"$373,585,825.00","$415,390,628.00","$788,976,453.00",PG-13
47,The Passion of the Christ (2004),2004,"Depicts the final twelve hours in the life of Jesus of Nazareth, on the day of his crucifixion in Jerusalem.",Newmarket Films,"$370,782,930.00","$241,271,576.00","$612,054,506.00",R
48,The Secret Life of Pets (2016),2016,"The quiet life of a terrier named Max is upended when his owner takes in Duke, a stray whom Max instantly dislikes.",Universal Pictures,"$368,384,330.00","$507,074,301.00","$875,458,631.00",PG
49,Despicable Me 2 (2013),2013,"When Gru, the world's most super-bad turned super-dad has been recruited by a team of officials to stop lethal muscle and a host of Gru's own, He has to fight back with new gadgetry, cars, and more minion madness.",Universal Pictures,"$368,065,385.00","$602,700,620.00","$970,766,005.00",PG
50,The Jungle Book (2016),2016,"After a threat from the tiger Shere Khan forces him to flee the jungle, a man-cub named Mowgli embarks on a journey of self discovery with the help of panther Bagheera and free-spirited bear Baloo.",Walt Disney Studios Motion Pictures,"$364,001,123.00","$602,553,806.00","$966,554,929.00",PG
51,Deadpool (2016),2016,"A wisecracking mercenary gets experimented on and becomes immortal but ugly, and sets out to track down the man who ruined his looks.",Twentieth Century Fox,"$363,070,709.00","$419,766,082.00","$782,836,791.00",R
52,Inside Out (2015),2015,"After young Riley is uprooted from her Midwest life and moved to San Francisco, her emotions - Joy, Fear, Anger, Disgust and Sadness - conflict on how best to navigate a new city, house, and school.",Walt Disney Studios Motion Pictures,"$356,921,711.00","$501,926,308.00","$858,848,019.00",PG
53,Aladdin (2019),2019,A kind-hearted street urchin and a power-hungry Grand Vizier vie for a magic lamp that has the power to make their deepest wishes come true.,Walt Disney Studios Motion Pictures,"$355,559,216.00","$695,134,737.00","$1,050,693,953.00",PG
54,Furious 7 (2015),2015,Deckard Shaw seeks revenge against Dominic Toretto and his family for his comatose brother.,Universal Pictures,"$353,007,020.00","$1,162,334,379.00","$1,515,341,399.00",PG-13
55,Transformers: Dark of the Moon (2011),2011,"The Autobots learn of a Cybertronian spacecraft hidden on the moon, and race against the Decepticons to reach it and to learn its secrets.",DreamWorks,"$352,390,543.00","$771,403,536.00","$1,123,794,079.00",PG-13
56,American Sniper (2014),2014,"Navy S.E.A.L. sniper Chris Kyle's pinpoint accuracy saves countless lives on the battlefield and turns him into a legend. Back home with his family after four tours of duty, however, Chris finds that it is the war he can't leave behind.",Warner Bros.,"$350,126,372.00","$197,300,000.00","$547,426,372.00",R
57,The Lord of the Rings: The Two Towers (2002),2002,"While Frodo and Sam edge closer to Mordor with the help of the shifty Gollum, the divided fellowship makes a stand against Sauron's new ally, Saruman, and his hordes of Isengard.",New Line Cinema,"$342,551,365.00","$604,943,730.00","$947,495,095.00",PG
58,Zootopia (2016),2016,"In a city of anthropomorphic animals, a rookie bunny cop and a cynical con artist fox must work together to uncover a conspiracy.",Walt Disney Studios Motion Pictures,"$341,268,248.00","$682,852,856.00","$1,024,121,104.00",PG
59,The Hunger Games: Mockingjay - Part 1 (2014),2014,"Katniss Everdeen is in District 13 after she shatters the games forever. Under the leadership of President Coin and the advice of her trusted friends, Katniss spreads her wings as she fights to save Peeta and a nation moved by her courage.",Lionsgate,"$337,135,885.00","$418,220,826.00","$755,356,711.00",PG-13
60,Spider-Man 3 (2007),2007,"A strange black entity from another world bonds with Peter Parker and causes inner turmoil as he contends with new villains, temptations, and revenge.",Sony Pictures Entertainment (SPE),"$336,530,303.00","$558,453,070.00","$894,983,373.00",PG-13
61,Minions (2015),2015,"Minions Stuart, Kevin, and Bob are recruited by Scarlet Overkill, a supervillain who, alongside her inventor husband Herb, hatches a plot to take over the world.",Universal Pictures,"$336,045,770.00","$823,398,892.00","$1,159,444,662.00",PG
62,Joker (2019),2019,"In Gotham City, mentally troubled comedian Arthur Fleck is disregarded and mistreated by society. He then embarks on a downward spiral of revolution and bloody crime. This path brings him face-to-face with his alter-ego: the Joker.",Warner Bros.,"$335,451,311.00","$738,968,073.00","$1,074,419,384.00",R
63,Aquaman (2018),2018,"Arthur Curry, the human-born heir to the underwater kingdom of Atlantis, goes on a quest to prevent a war between the worlds of ocean and land.",Warner Bros.,"$335,061,807.00","$813,424,079.00","$1,148,485,886.00",PG-13
64,Spider-Man: Homecoming (2017),2017,"Peter Parker balances his life as an ordinary high school student in Queens with his superhero alter-ego Spider-Man, and finds himself on the trail of a new menace prowling the skies of New York City.",Sony Pictures Entertainment (SPE),"$334,201,140.00","$545,965,784.00","$880,166,924.00",PG-13
65,Alice in Wonderland (2010),2010,"Nineteen-year-old Alice returns to the magical world from her childhood adventure, where she reunites with her old friends and learns of her true destiny: to end the Red Queen's reign of terror.",Walt Disney Studios Motion Pictures,"$334,191,110.00","$691,277,106.00","$1,025,468,216.00",PG
66,Guardians of the Galaxy (2014),2014,A group of intergalactic criminals must pull together to stop a fanatical warrior with plans to purge the universe.,Walt Disney Studios Motion Pictures,"$333,718,600.00","$439,631,547.00","$773,350,147.00",PG-13
67,Forrest Gump (1994),1994,"The presidencies of Kennedy and Johnson, the Vietnam War, the Watergate scandal and other historical events unfold from the perspective of an Alabama man with an IQ of 75, whose only desire is to be reunited with his childhood sweetheart.",Paramount Pictures,"$330,455,270.00","$347,770,863.00","$678,226,133.00",PG-13
68,Batman v Superman: Dawn of Justice (2016),2016,"Fearing that the actions of Superman are left unchecked, Batman takes on the Man of Steel, while the world wrestles with what kind of a hero it really needs.",Warner Bros.,"$330,360,194.00","$543,277,334.00","$873,637,528.00",PG-13
69,It (2017),2017,"In the summer of 1989, a group of bullied kids band together to destroy a shape-shifting monster, which disguises itself as a clown and preys on the children of Derry, their small Maine town.",Warner Bros.,"$328,828,874.00","$372,967,570.00","$701,796,444.00",R
70,Suicide Squad (2016),2016,A secret government agency recruits some of the most dangerous incarcerated super-villains to form a defensive task force. Their first mission: save the world from the apocalypse.,Warner Bros.,"$325,100,054.00","$421,746,840.00","$746,846,894.00",PG-13
71,Deadpool 2 (2018),2018,"Foul-mouthed mutant mercenary Wade Wilson (a.k.a. Deadpool) assembles a team of fellow mutant rogues to protect a young boy with supernatural abilities from the brutal, time-traveling cyborg Cable.",Twentieth Century Fox,"$324,591,735.00","$461,304,874.00","$785,896,609.00",R
72,Shrek the Third (2007),2007,"Reluctantly designated as the heir to the land of Far, Far Away, Shrek hatches a plan to install the rebellious Artie as the new king while Princess Fiona tries to fend off a coup d'état by the jilted Prince Charming.",DreamWorks,"$322,719,944.00","$490,647,436.00","$813,367,380.00",PG
73,Jumanji: The Next Level (2019),2019,"In Jumanji: The Next Level, the gang is back but the game has changed. As they return to rescue one of their own, the players will have to brave parts unknown from arid deserts to snowy mountains, to escape the world's most dangerous game.",Sony Pictures Entertainment (SPE),"$320,314,960.00","$479,744,747.00","$800,059,707.00",PG-13
74,Transformers (2007),2007,"An ancient struggle between two Cybertronian races, the heroic Autobots and the evil Decepticons, comes to Earth, with a clue to the ultimate power held by a teenager.",DreamWorks,"$319,246,193.00","$390,463,587.00","$709,709,780.00",PG-13
75,Iron Man (2008),2008,"After being held captive in an Afghan cave, billionaire engineer Tony Stark creates a unique weaponized suit of armor to fight evil.",Paramount Pictures,"$319,034,126.00","$266,762,121.00","$585,796,247.00",PG-13
76,Harry Potter and the Sorcerer's Stone (2001),2001,"An orphaned boy enrolls in a school of wizardry, where he learns the truth about himself, his family and the terrible evil that haunts the magical world.",Warner Bros.,"$318,087,620.00","$698,725,454.00","$1,016,813,075.00",PG
77,Indiana Jones and the Kingdom of the Crystal Skull (2008),2008,"In 1957, archaeologist and adventurer Dr. Henry ""Indiana"" Jones, Jr. is called back into action and becomes entangled in a Soviet plot to uncover the secret behind mysterious artifacts known as the Crystal Skulls.",Paramount Pictures,"$317,101,119.00","$473,552,823.00","$790,653,942.00",PG-13
78,The Lord of the Rings: The Fellowship of the Ring (2001),2001,A meek Hobbit from the Shire and eight companions set out on a journey to destroy the powerful One Ring and save Middle-earth from the Dark Lord Sauron.,New Line Cinema,"$315,710,750.00","$581,979,322.00","$897,690,072.00",PG-13
79,Thor: Ragnarok (2017),2017,"Imprisoned on the planet Sakaar, Thor must race against time to return to Asgard and stop Ragnarök, the destruction of his world, at the hands of the powerful and ruthless villain Hela.",Walt Disney Studios Motion Pictures,"$315,058,289.00","$538,925,622.00","$853,983,911.00",PG-13
80,Iron Man 2 (2010),2010,"With the world now aware of his identity as Iron Man, Tony Stark must contend with both his declining health and a vengeful mad man with ties to his father's legacy.",Paramount Pictures,"$312,433,331.00","$311,500,000.00","$623,933,331.00",PG-13
81,Star Wars: Episode II - Attack of the Clones (2002),2002,"Ten years after initially meeting, Anakin Skywalker shares a forbidden romance with Padmé Amidala, while Obi-Wan Kenobi investigates an assassination attempt on the senator and discovers a secret clone army crafted for the Jedi.",Twentieth Century Fox,"$310,676,740.00","$343,103,230.00","$653,779,970.00",PG
82,Pirates of the Caribbean: At World's End (2007),2007,"Captain Barbossa, Will Turner and Elizabeth Swann must sail off the edge of the map, navigate treachery and betrayal, find Jack Sparrow, and make their final alliances for one last decisive battle.",Walt Disney Studios Motion Pictures,"$309,420,425.00","$651,576,067.00","$960,996,492.00",PG-13
83,Star Wars: Episode VI - Return of the Jedi (1983),1983,"After a daring mission to rescue Han Solo from Jabba the Hutt, the Rebels dispatch to Endor to destroy the second Death Star. Meanwhile, Luke struggles to help Darth Vader back from the dark side without falling into the Emperor's trap.",Twentieth Century Fox,"$309,306,177.00","$122,009,457.00","$475,106,177.00",PG
84,Independence Day (1996),1996,"The aliens are coming and their goal is to invade and destroy Earth. Fighting superior technology, mankind's best weapon is the will to survive.",Twentieth Century Fox,"$306,169,268.00","$511,231,623.00","$817,400,891.00",PG-13
85,Pirates of the Caribbean: The Curse of the Black Pearl (2003),2003,"Blacksmith Will Turner teams up with eccentric pirate ""Captain"" Jack Sparrow to save his love, the governor's daughter, from Jack's former pirate allies, who are now undead.",Walt Disney Studios Motion Pictures,"$305,413,918.00","$348,850,097.00","$654,264,015.00",PG-13
